review_id,steam_id,num_games_owned,num_reviews,playtime_forever_hrs,playtime_at_review_hrs,recommended,votes_up,votes_funny,weighted_vote_score,comment_count,steam_purchase,received_for_free,written_during_early_access,language,date_created,date_updated,review_text
227565855,76561199080321807,0,13,17.7,17.7,True,0,1,0.5,0,True,False,False,russian,2026-06-09 14:08:10,2026-06-09 14:08:10,неплохие боссы. но конец душит платформингом
227548322,76561198108127710,0,93,2.6,2.6,False,1,0,0.52173912525177002,0,True,False,False,english,2026-06-09 08:49:24,2026-06-09 08:54:04,"The game tries very hard to introduce unique mechanics and interesting setting. Despite the efforts it feels like every other Dark Souls clone in 2D, and initially interesting setting quickly appears dull and meaningless. After two hours I just forgot about the game, I wasn't engaged in combat and I didn't care for the characters. If there is some deeper meaning in the setting, the level of abstraction made me feel so detached, I became convinced this won't get any better. Initially, I was attracted to Grime because of its creepy and gross elements. Once I got into the game, it was clear, that I'm not in for exploring a disturbing, surreal world, but rather for being a weird stone figure walking around stones, finding some stones and beating up some other weird stones."
227548121,76561199017470413,120,3,1.2,1.2,False,0,0,0.5,0,True,False,False,schinese,2026-06-09 08:44:44,2026-06-09 08:44:44,无聊，简陋，毫无特色，开个丝之歌新档都比这缝合烂游戏有新意
227545143,76561198005251765,857,13,19.8,17.9,True,0,0,0.5,0,True,False,False,english,2026-06-09 07:42:34,2026-06-09 07:42:34,"This game is a hidden gem to me, nearly on par with games like Ori and the Blind Forest. Yes the visuals are not as impressive, but it really gets the ""grimy"" feel with a mix of living stone and corpse-like features. Yes on one hand minor enemies often have very little visual cues for their attacks but I honestly believe that this game has some of the best designed boss fights in any Metroidvania. Combat is hard but fair imo and as soon as you really get the enemies' attack patterns down the way you have to interweave your attacks and defensive abilities is so very satisfying. Every time I start this game up I am quickly reminded of how ""solid"" it feels and every time I finally end a session I just finish with ""man, this is a great game!""."
227542111,76561198286771015,30,1,60.6,60.2,False,0,0,0.5,0,False,False,False,schinese,2026-06-09 06:19:39,2026-06-09 06:19:39,动作僵硬，镜头移动不符合逻辑，传送界面设计不直观
227530801,76561199163551742,0,2,5.2,5.2,False,0,0,0.5,0,True,False,False,schinese,2026-06-09 01:27:40,2026-06-09 01:27:40,玩法和画风都挺新颖的，就是手感一般还有体力机制太劝退，闪避两下就啥也干不了了，要是有两个怪在面前，直接被当靶子打，急的直接乱点，闪避耗体力我能理解，前期坐牢的点在于平a跳跃都需要体力，而且消耗特别快，我不知道作者怎么想的，纯纯折磨人
227521065,76561199703247362,0,20,22.4,22.4,True,0,0,0.5,0,True,False,False,russian,2026-06-08 22:03:17,2026-06-08 22:10:53,"Самая душная метроидвания, что я видел. Менеджмент стамины ужасный, ее постоянно не хватает то на доджи, то на атаки, при условии, что играл я билдом через стамину. Противники дальнего боя постоянно видят нас раньше чем мы их. Ситуации, когда откуда-то из-за экрана прилетает какое-то говно и наносит урон, возникают постоянно. Графически иногда выглядит впечатляюще, особенно появление финального босса, а иногда на экране какое-то месиво из текстур 3D мультфильмов 90-х. Но игра, в целом, хорошая."
227495572,76561198262740557,143,17,12.2,12.2,True,0,0,0.5,0,False,False,False,english,2026-06-08 15:48:34,2026-06-08 15:48:34,"wide guy, big gravity"
227481638,76561199567899894,499,51,0.9,0.9,False,0,0,0.5,0,False,False,False,schinese,2026-06-08 12:03:59,2026-06-08 12:04:17,玩法挺新颖，只不过手感有点像玩太空泥的感觉，放在游戏里就是非常的奥里给。
227435621,76561198083789673,266,38,62.9,62.9,True,0,0,0.5,0,True,False,False,brazilian,2026-06-07 19:38:09,2026-06-07 19:38:09,"As batalhas contra os bosses são INCRÍVEIS!!! Foi épico! São batalhas cheias de ação, a música e o design dos cenários são uma obra de arte! Os controles são muito bons; gráficos lindos e intrigantes; a ambientação foi excelente, cada área do jogo tem todo um contexto próprio, paleta de cores, os efeitos de luzes e reflexo, música muito envolvente, os monstros, tudo. Destaque também pras imagens de fundo! Tem algumas partes do jogo em que o fundo do cenário é hipnotizante! Principalmente na última parte.  Ponto negativo: o enredo. É confuso, abstrato demais, deixa de explicar quase tudo naquele universo. Mesmo fluente em inglês, entendi muito pouco sobre a história. Não há explicitamente um objetivo final para o personagem, nem sabemos porque ele está ali. Talvez precise prestar atenção nas descrições de itens, e anotar conversas pra tentar ligar os pontos, mas pra mim não ficou claro. E mesmo assim, a história acabou sendo totalmente irrelevante para o jogo. Se não houvesse nenhum diálogo, o jogo continuaria o mesmo sem nenhuma alteração."
227417497,76561198080691023,237,37,35.8,29.8,True,0,0,0.5,0,True,False,False,schinese,2026-06-07 16:00:12,2026-06-07 16:00:12,类银河恶魔城的优秀作品，跳跳乐恰到好处，成长搜集也充满乐趣，美中不足就是怪物伤害太高
227413799,76561198383346969,191,12,32.0,32.0,True,0,0,0.5,0,False,False,False,schinese,2026-06-07 15:12:15,2026-06-07 15:12:15,前期隐藏的很好的跳跳乐游戏，刚开始玩的时候战斗爽，在你爽的不能的时候制作组不演了，尼玛后面全是跳跳乐，几分钟脚不沾地
227402958,76561198121346718,895,101,20.4,19.2,True,0,0,0.5,0,False,False,False,koreana,2026-06-07 12:46:11,2026-06-07 12:46:11,"소울라이크와 메트로베니아를 잘 융합한 겜 패링 기반의 액션과 강화요소들이 특색이 있고 무기마다 모션이 다른 디테일이 뛰어나다"
227362613,76561199222361979,241,17,21.8,21.8,True,0,0,0.5,0,True,False,False,brazilian,2026-06-07 00:01:41,2026-06-07 00:01:41,mto loco
227339255,76561199084340485,0,6,55.8,34.6,True,1,0,0.533898293972015381,0,True,False,False,russian,2026-06-06 18:13:50,2026-06-06 18:13:50,"Игра бросает вызов который интересно преодолевать. А разнообразие оружия, сетов брони и перков помогают в этом."
227217114,76561197973577725,7143,129,3.4,3.4,False,1,0,0.499679684638977051,0,False,False,False,english,2026-06-05 08:08:52,2026-06-05 08:08:52,"You once had a cool, unique art style, back when this game launched. Now the box art is a smear of pink and purple like EVERYTHING ELSE. Why did you do this? There is FAR too much of this. Stop it."
227211459,76561198042344427,0,6,9.3,9.3,False,4,0,0.558394193649291992,0,True,False,False,english,2026-06-05 05:41:48,2026-06-05 05:41:48,"I did not have fun. I kept trying, game just kept building friction instead of enjoyment. I've played many soulslikes and metroidvanias and love those genres, but did not enjoy this one. I think it is trying too hard to be obtuse and difficult, and forgot what it meant to make a fun game."
227172056,76561198056757914,0,1,15.8,15.8,False,0,0,0.5,0,False,False,False,italian,2026-06-04 17:21:58,2026-06-04 17:21:58,The game is good but from a certain point has become unplayable due to the stuttering
227160833,76561199655287990,0,3,8.9,8.9,True,0,0,0.5,0,True,False,False,english,2026-06-04 14:39:13,2026-06-04 14:39:13,Amazing
227131471,76561199867210695,0,3,4.8,4.8,True,0,0,0.5,0,False,False,False,schinese,2026-06-04 03:15:02,2026-06-04 03:15:02,才打到花母 感觉挺可以的
227061740,76561199753863138,51,16,36.6,36.6,True,0,0,0.5,0,False,False,False,schinese,2026-06-03 03:39:59,2026-06-03 03:39:59,优秀的类银
227050495,76561198212862213,246,32,0.8,0.8,False,1,0,0.52173912525177002,0,True,False,False,english,2026-06-02 23:21:53,2026-06-02 23:21:53,"Wanted to give this game a try for the second time. But sadly nearly none of it vibes well with me from the beginning section. Movement feels way off. The camera bugs simply by looking up or down creating jarring camera movements. Animations and sound feel weird. Way too much jank for me.  Enemy attacks (at least in the first area) feel inconsistent in when you expect the animation to actually hit you, which feels like a problem considering the importance of the parry mechanic. Even if you can predict the attack's animation you have to arbitrarily figure out when the actual hitbox appears to learn the parry timing. Enemy's entire arms will already be going through my body but somehow the attack isn't happening yet.   My understanding is that a lot of this is probably intentional, considering the artstyle and gameplay mechanics it feels like an intentional recreation of classic soulslike feel, including some jank. But it makes me uncomfortable to be playing the game at all.  The apparant difficulty of the game from the first boss is exciting though. Might try it again later when I may be in a more fitting mood to be able to move past my issues with it."
226986782,76561198062406916,0,21,19.4,19.4,True,0,0,0.5,0,True,False,False,english,2026-06-02 02:20:14,2026-06-02 02:20:14,A very good metroid game that im very excited to play the sequel of
226976500,76561197995493411,1017,410,23.6,17.6,True,0,0,0.5,0,True,False,False,english,2026-06-01 22:41:03,2026-06-03 22:38:47,Actually one of my favorite metroid-vanias. Definitely has some rough edges but it's so surreal and interpretable that I really appreciate that it exists.   Cells at work.
226934440,76561198101498891,364,184,25.2,25.2,True,0,0,0.5,0,True,False,False,english,2026-06-01 11:02:09,2026-06-01 11:02:09,I've never really played metroidvanias i tried hollow knight around 2019 and didn't like and then my best friend recommended me this game and it has become one of my favorite games its top 10 for me really cool artstyle and story
226932511,76561198347979758,99,36,2.8,2.8,False,6,1,0.538138270378112793,12,False,False,False,english,2026-06-01 10:16:24,2026-06-01 10:16:24,"Terrible artstyle, level design, enemies, bosses, and everything else about this was pathetic. worst metroidvania ive ever played"
226865794,76561198160417043,0,33,24.3,24.3,False,2,0,0.518201291561126709,0,True,False,False,russian,2026-05-31 13:51:51,2026-05-31 13:51:51,"♥♥♥♥♥♥♥, ну вот ♥♥♥♥♥♥♥. Ваншот-паркур,вагшот-паркур,ваншот-паркур. И бесконечные побегуши. Сперва играется норм, а потом бегай и лови ваншоты. НЕ, спасибо. Не буду бегать и паркурить.  Игра - Иди ♥♥♥♥♥"
226849084,76561198099251959,0,1,4.8,4.8,True,1,0,0.533898293972015381,0,True,False,False,russian,2026-05-31 09:16:11,2026-05-31 09:16:11,"A surreal, rock-hard metroidvania with a black hole for a head. Visually stunning, brutally challenging, and incredibly satisfying. Absolute masterpiece for Souls-like fans."
226846365,76561199189653452,100,38,20.1,20.1,False,0,0,0.465686261653900146,0,False,False,False,schinese,2026-05-31 08:25:46,2026-05-31 08:25:46,美术方面：不喜欢这种黑不溜秋的美术风格和丑陋扭曲的怪物形象 成就方面：全成就得二周目，对于成就党不友好，另外如果想要全成就就必须得跑一段超长超痛苦跳跳乐（与主线无关）（感觉这个游戏20小时流程，得有2小时是在这个跳跳乐上） 战斗方面：弹反判断比较宽松，并且弹反收益高，有堪称轮椅的武器，但是有些BOSS确实难度不低 地图探索部分：篝火太少了太少了，两个篝火之间经常隔着365里路，如果路上死了就得重新跑图，而且在没有拿到这个区域的地图之前，探索是不会点亮地图的
226841464,76561199243964251,136,131,20.7,20.7,True,1,0,0.508928596973419189,0,True,False,False,english,2026-05-31 06:47:10,2026-05-31 06:47:10,"What an absolute masterpiece of a game! I remember when this game first came out, I got addicted to it all the way up to Shapely Fidus! They became my wall. I just couldn't get passed them! Come all these years later after I got plenty of Soulslike experience under my belt, Shapely Fidus round 2 was a lot easier! Running around with a Cinderblock tied to a stick is also a lot of fun, and the bosses in this game are so memorable! I absolutely LOVED this game, and finally get to cross it off my Soulslike list!"
226838957,76561199497447593,350,75,24.4,3.5,True,0,0,0.5,0,True,False,False,schinese,2026-05-31 05:52:27,2026-05-31 05:52:27,好玩，吸收机制很爽，优秀的boss战，打击手感也很好
226771339,76561198043287734,487,93,43.4,43.4,True,0,0,0.5,0,True,False,False,english,2026-05-30 11:37:09,2026-05-30 11:37:09,Decent metroidvania I had to get used to movement. [spoiler]The elevator bossfight is great.[/spoiler]
226727380,76561197994396251,997,81,37.7,37.2,True,2,0,0.52173912525177002,0,True,False,False,english,2026-05-29 20:59:18,2026-05-29 20:59:18,"A really solid Metroidvania.  Pros: - Great variety of armor and weapons - Challenging boss and enemy difficulty - Rewarding secret areas to discover - Smooth gameplay mechanics and satisfying skills  Cons: - Too few side quests - Over-reliance on the parry mechanic - Tedious late-game grinding due to a lack of good farming spots"
226623587,76561198250623166,297,154,31.9,31.9,True,0,0,0.5,0,True,False,False,russian,2026-05-28 13:40:19,2026-05-28 13:40:19,"Прикольная игра, локации паркурные конечно жесть, хорошо, что повторно их проходить не обязательно."
226605881,76561198209046817,275,83,4.7,4.7,False,2,0,0.519841313362121582,0,True,False,False,schinese,2026-05-28 07:03:41,2026-05-28 07:03:41,这种垃圾能出二代在座各位都有责任
226538578,76561198067448673,0,59,16.9,16.9,False,1,0,0.5,0,False,False,False,schinese,2026-05-27 09:46:08,2026-05-27 09:46:08,前一个小时很不错。后面真的玩恶心了。探索强度这么高，能力锁这么密集，但给的奖励是1000块钱。绝。
226422398,76561198284894230,1163,84,2.0,1.5,False,1,0,0.496732026338577271,0,True,False,False,schinese,2026-05-25 21:56:52,2026-05-25 21:56:52,买了一只没玩，这出了二代，就把这库里吃土的游戏下来一试！ 结果这糟糕的手感，僵硬的动作，地图还尼玛得单独点亮，傻逼精力条设计(两个冲刺直接罚站)， 前期两个怪同时出现，大概率就应付不了了！ 这游戏能出第二作，所有人都尼玛有相当大的责任！ 看评测买游戏，跟风儿害死人！
226339016,76561197986517035,1647,112,14.0,14.0,True,3,0,0.544728457927703857,0,True,False,False,english,2026-05-24 20:48:31,2026-05-24 20:48:31,"It's fine. Controls can be a bit clunky, especially in platforming sections. The aesthetic is weird but it kinda works."
226335263,76561198173731431,403,52,23.0,22.1,True,0,0,0.5,0,False,False,False,brazilian,2026-05-24 19:53:20,2026-05-24 19:53:20,"Um otimo metroidvania, mas entendi nada da historia kkkkkkkk Mas valeu a pena dar uma chance.  Tinha na epic, mas queria na steam e peguei numa promoção !"
226304413,76561198097059546,0,33,26.7,26.7,False,3,0,0.540347278118133545,0,True,False,False,russian,2026-05-24 12:54:04,2026-05-24 12:54:04,"В данном случае у меня претензии скорее не к самой игре, а к её создателям. Здесь невооружённым взглядом видно, насколько же они ненавидят игроков. Они в своей игре сделали всё, чтобы основательно и бесповоротно задушить любого нормального геймера. Игра не столько сложная (хотя и это тоже, на мой казуальный вкус), сколько феерически удушающая. Во всех своих аспектах. Геймплейно - телепорты между местными кострами открываются чуть ли не в конце игры, а добрую половину карты мы будем зачищать с одной хилящей флягой, которую можно рефильнуть лишь у костров либо парированиями. А чтобы получить вторую и третью флягу - нужно убить целую пачку сайд-боссов, кайф. Боёвка - стамина будет душить до самого финального босса. И не важно, сколько её - 5 или 50, всё равно будет не хватать. Я под конец психанул и реально перекачался в 50 стамины - разницы не ощутил. Акробатическое испытание (местный Белый Дворец \ Путь боли) я не осилил, да, руки кривые, но ещё и сама игра ставит палки в колёса. Местами герой тупо отказывался бежать, а просто шёл пешочком, я уже начал грешить на свой старенький геймпад от Xbox 360, перебиндил бег сначала на RT, потом на LT - сейм щит. После этого просто забил. И так здесь куда ни ткнись, любая составляющая игры заставляет тебя душиться и страдать. Возможно, сосаликовые фанаты этому только рады, для них это стиль жизни, иначе 86% положительных я никак объяснить не могу. От меня однозначно жирнющий палец вниз."
226290457,76561198833742723,66,2,39.6,39.6,True,0,0,0.5,0,False,False,False,schinese,2026-05-24 08:41:16,2026-05-24 08:41:16,好玩，美术风格很有特色，不过地图的隐藏太多了对路痴来说有点麻烦
226269029,76561198067523971,488,27,31.9,31.9,True,1,0,0.508928596973419189,0,False,True,False,english,2026-05-24 01:13:14,2026-05-24 01:13:14,i loved this game!!! so creative and unique <3
226258309,76561198000940453,0,3,6.6,4.7,False,2,0,0.489577919244766235,0,False,False,False,english,2026-05-23 21:49:13,2026-05-23 21:49:13,"Mid-grade MV.  Developers seem to often confuse being clever with being obnoxious.  Boss fights are the star, traveling is bad for a number of reasons.  The ""Souls-like"" elements are not done very well in general but can be intermittently satisfying.  The 3D art and sound design far outshine the game play."
226227149,76561199053791543,926,18,42.6,42.6,True,1,0,0.520547926425933838,0,True,False,False,schinese,2026-05-23 14:33:34,2026-05-23 14:37:21,作为一款2.5D的类银河恶魔城作品，grime可以算作短小精悍。本身的画风比较奇特，与常有的中世纪风格不同，反而采取了这种很有异质感的岩石和蜡制生物风格，确实独出心裁。而在战斗系统方面，本作的武器大概可以分成几个类型，匕首、灯笼、拳套、单手武器和重型武器，不同类型之间的战斗风格和加点都不同，且都具有独有的战技，颇有魂like的感觉，而且大部分武器的攻击模组都不同，同时装备两把武器切换甚至可以产生1+1>2的效果，非常不错。此外，本作的弹反/吸收系统很有特色，后期技能解锁后人物的性能也非常强，导致本作的跳跳乐手感非常舒适，哪怕有专门模仿苦痛之路的彩蛋关卡，也不会让人红温，而且本作的魂不会因死亡掉落，只会有热情损失，相对来说是一部非常新手友好的类银游戏。 但本作也有一些缺点，首先是战斗手感有时候会显得有些滞重，尤其是在吸收前后的慢动作，有时会导致操作手感的卡顿，以及部分怪喜欢在2.5D的条件下做出z轴方向上的小幅度攻击，配上昏暗的背景，打得有点无言了；此外，本作的传送系统在dlc区域才解锁，如果不按攻略而是自己探索的话，可能会有365里路环节，尤其是得到新能力回去拿某些特殊位置的道具时，因此推进先拿传送能力再继续推图；此外就是剧情方面，本作的剧情过于晦涩难懂，再加上一些特定概念和名词，哪怕后面专门做了苍白天空这种纯跳跳乐图来解说剧情，也还是显得有些过于碎片化。 总体来说本作是一部短小但优质的类银作品，在一众类银作品中都算排名比较靠前的存在，在闲暇时花点时间就可以轻松白金，非常推荐入手。 话说最近好像还出了2，不赖，有空就去尝尝味儿。 哦对了，补充一句，2周目开始敌人的强度和攻击技能都有变化，这是个很好的设计，就是有的设计得过于恶心[spoiler] （就是你，秃鹫） [/spoiler]，此外一周目达成特定条件就能在二周目解锁一个新boss，但有点抽象的是想全收集得在接下来十几个周目都打一遍这个boss，这是否...
226223223,76561199100024644,162,5,34.0,27.2,True,0,0,0.5,0,True,False,False,russian,2026-05-23 13:37:05,2026-05-23 13:37:05,"Последнии пять очивок дрочь. Но в целом игра соблюдает темп. Проблема естть в прогресии. А именно хоть ти перекачь хоть недокач умираеш с двух ударов. Не много затянули, но в целом я доволен геймплеем. Лор тоже широкий и сужетка интересная особенно квест слушателя."
226206273,76561198243576606,0,6,18.4,18.4,True,0,0,0.5,0,True,False,False,english,2026-05-23 08:32:20,2026-05-23 08:32:20,never seen a game so visually appealing yet serves great gameplay experiences
226197211,76561198010061920,0,195,11.6,3.5,True,0,0,0.5,0,True,False,False,russian,2026-05-23 05:18:46,2026-05-23 05:18:46,Good game
226178481,76561198810199839,117,6,70.3,70.3,True,1,0,0.523809552192687988,0,True,False,False,russian,2026-05-22 22:54:51,2026-05-22 22:54:51,"Очень интересная игра с большим количеством секретов и в духе Миядзаки сюжетом, по типу догадайся о чем это вообще.  Рекомендую."
226129467,76561198284883742,0,55,25.2,25.2,True,0,0,0.5,0,True,False,False,russian,2026-05-22 10:06:15,2026-05-22 10:06:15,"Мне очень понравился дизайн и лор мира. Боевка приятная но персонаж чересчур хрупкий, это может раздражать. Тонна филлерного лута, с этим явный перебор."
226124438,76561198403502323,91,12,60.0,60.0,True,0,0,0.5,0,True,True,False,english,2026-05-22 08:02:25,2026-05-22 08:02:25,very goood game
226094319,76561199095635805,334,47,31.0,30.6,True,0,0,0.485339939594268799,0,True,False,False,koreana,2026-05-21 20:45:33,2026-05-21 20:45:33,재밌어요.
