review_id,steam_id,num_games_owned,num_reviews,playtime_forever_hrs,playtime_at_review_hrs,recommended,votes_up,votes_funny,weighted_vote_score,comment_count,steam_purchase,received_for_free,written_during_early_access,language,date_created,date_updated,review_text
213257777,76561198999241114,65,4,42.5,42.5,True,7,0,0.619406938552856445,0,False,False,False,schinese,2025-12-14 07:00:07,2025-12-14 07:00:07,一部冷门且被人忽视的类银河城，如果你能接受渎神的画风，那么本作大概率能对你的胃口，是另一种怪诞诡异且超现实主义风格的类银河城游戏。  本作主要围绕着“吸收”这个能力完成整个流程，也就是弹反。使用吸收击杀敌人可以获取当前敌人的特质，通过探索获取的各种资源可以培养并提升特质，因此可以诞生许多不同的流派。不同武器也围绕着5种不同属性有着不一样的提升，因此可玩性很高。游玩的很大一部分动力来自于探索并吸收不同猎物的特质并强化自己，找到适合自己流派的武器。但游戏体量不是特别大，特质说多也多说少也少，中后期就可以收集完全，且一个周目的资源基本上只能选一种流派进行游玩，想体验更多流派得进入多周目。游戏有耐力条的设定，也就是游戏中的“力量”（大概率是翻译问题）。前期耐力很少，没有耐力就无法攻击闪避，所以本作前中期的难度还是不小，手残党可能容易劝退。不过本作的死亡惩罚基本等于没有，算是在难度上的一点补偿。所以难度上我个人觉得是可以接受的。  游戏的boss我觉得设计的挺不错，打的很爽的同时也不会有那种卡很久的存在，且每击败一个boss可以获取不同的能力，正反馈很好。多周目的boss有不同程度的增强，也是很有挑战性的一点。但是本作战斗和跑图手感因人而异，要上手了才知道到底是怎样的，适不适合自己。  不过本作后期跳跳乐关卡数量不少难度也不算低，且经常完成之后给的奖励并不如人意。跳跳乐苦手要注意。（本作有类似白宫加苦痛的组合）  总体而言，我的评价是8/10，是一部十分值得体验的类银河城游戏。
213248340,76561198011468068,3565,77,4.9,4.9,False,3,0,0.45942726731300354,0,True,False,False,russian,2025-12-14 03:33:29,2025-12-14 03:33:29,Управление полный пи*%ец
213188011,76561198972396452,94,7,13.4,13.4,False,0,1,0.410790950059890747,0,False,False,False,russian,2025-12-13 11:17:12,2025-12-13 11:17:12,При прохождении игры каждый раз закидывает в какую-то комнатушку с куском кровометалла из которой нет выхода. Игра дерьмо не покупайте её.
213174475,76561198036603729,1269,112,19.2,17.7,True,0,0,0.5,0,False,False,False,schinese,2025-12-13 06:35:28,2025-12-13 06:35:28,本来想说这游戏被低估了，但看了下很多差评其实说得还是很有道理的。  优点：风格突出，战斗偏硬派风格，探索感比较足部分箱庭解密设计出色就是这种老式调调可能多少有点不合时宜。 当然优点很多需要对点电波...  缺陷：一大堆武器估计一周目完全没法用，装备存在感弱。  粪点：传送机制弄单独的传送点真的就是一坨，完全没必要。完全可以整合进存档点，目前这种设计就是纯导致无意义的绕远路。  总感觉大家对银河城尤其苛刻啊，哈，  最近玩了终焉的木兰花跟GRIME，有一说一愉悦感都是远超过其他类型7、8分说法的游戏的， 但到了银河城里很多人就只有个凑合了，毕竟这类型太成熟神仙太多了，动不动评价就会冲着六边形全满去比较吧。
213115580,76561198836269369,0,41,41.6,40.9,True,0,0,0.5,0,True,False,False,english,2025-12-12 13:02:34,2025-12-12 13:02:34,"Ok so I played this game for a few hours and put it down for a long time. I've played damn near every metroidvania on steam, my favorite type of game, and coming back to this I've actually enjoyed it. At first I wasn't sure, it's difficult at the start, but as I leveled up and got more weapons and figured the game out, I couldn't put it down. The art style is very unique, I love it. The only caveat to this game is that every boss has a pattern, that once you figure it out, you can dance circles around the boss like it's nothing. At that point your level won't matter much.   I like that you can gain abilities from the enemies you siphon, but it seems the chore is too few and far between. You really have to pick the abilities that you use. The 2 where you do damage on parry and dodge are 2 of the best, along with the immediate heal for 150/200%. Also there are a lot of weapons in game, but I found myself using the nail spear thing for more than half the game as many weapons have very high stat requirements to use. All that said I'm very excited for Grime 2.   My favorite metroidvania games are Hollow knight and Blasphemous series. Though I put down HK2 in act 3 due to the frustrating difficulty, I'll pick it up at some point again. Oh and there's some frustrating platforming stuff later in grime, not as bad as that end part in HK2 but still frustrating. Platforming is probably my worst thing about metroidvania games. That stuff can make a game ridiculous. That's why I put Aetrna on the easier setting. I just can't deal with stuff like the end of HK2."
213074262,76561199191384014,538,26,2.9,1.8,True,0,0,0.5,0,False,False,False,spanish,2025-12-11 21:18:11,2025-12-11 21:18:11,Su aparente tosquedad es su mayor encanto.
213060956,76561198394047303,237,63,5.3,5.3,False,0,0,0.5,0,True,False,False,schinese,2025-12-11 17:40:22,2025-12-11 17:40:22,"玩了一会感觉不是很喜欢，买之前以为是类银河恶魔城的类型，玩了之后发现还掺杂了像盐与避难所的那种类魂元素，前期精力限制和怪物的慢动作攻击让人感觉整个游戏都慢吞吞的，为了控精力就要在攻击和立回间做取舍，但前面那精力回复简直慢得惊人，我看着屏幕简直就像是在看两个ICU老年人在扯头发。 就我游戏前期玩到的内容来说感觉有些主推弹反回能，一定能量可以回复血量。所以如果你能把怪物的攻击节奏感弄清楚就能很轻松应对。但玩的时候我经常是直接等招要么吸收回点能，或者挨一顿打吸取对敌经验。然后到了后面一点又出现了灰盾敌人，弹灰盾不给回能的，这时候感觉就是要求攻击加上弹反、闪避了。去野兽巢穴那关路上有个好像叫石花的boss，全过程灰盾二阶段还双打，我硬是顶着精力限制和无法回能慢慢刮死了，虽然不算很难，但是打起来真的折磨。闯关的时候就经常有多人群殴，远程近战都有，虽然可以拉扯应对，但是精力限制加上角色的粘滞操作手感还是太恶心了。 而怪物方面感觉基本都像是东拼西凑出来的，除了千篇一律的长得怪了点，基本就没有什么印象分，非常的普通无趣，攻击方式也挺无聊的。直到我打完地底的一只鸟尸体和螃蟹，我只感觉碾死了几只恶心的臭虫，趣味乏善可陈。哪怕给几个魔法，只要弹反或者攻击到就给能量使用都行啊。 而后面可能还要找这些怪东西刷刷刷，找到精英粪怪拿技能点，最后提升角色百分之几十的数值并进行构筑，还要找材料升级武器，我望着一路上捡到但是基本可能永远都用不上的各种垃圾就有些头大。"
213008424,76561199485526780,99,7,61.4,61.4,True,0,0,0.5,0,True,False,False,brazilian,2025-12-10 21:10:36,2025-12-10 21:10:36,Jogo bom
212986630,76561198340733674,721,171,35.4,35.4,True,0,0,0.5,0,False,False,False,schinese,2025-12-10 15:04:46,2025-12-10 15:04:46,弹，弹，弹，弹走所有人。  学会弹反，就等于选择了一段相对轻松的类恶魔城之旅。  但不看攻略会在开了门后错过个能力，这样的事儿，不要啊！  倒数第二个地图的纯解谜关卡很粪，此乃这类游戏的经典要素，不得不尝。  总的来说，类恶魔城爱好者值得一玩。
212928854,76561198024626467,263,45,33.0,29.4,True,1,0,0.519999980926513672,0,False,False,False,spanish,2025-12-09 17:50:50,2025-12-09 17:50:50,buen juego y gameplay aunque la historia no la entendi :p
212892152,76561199276138985,0,223,13.7,13.7,True,2,0,0.545454561710357666,0,True,False,False,english,2025-12-09 03:38:10,2025-12-09 03:38:10,"There was a few times that I was incredibly close to dropping this game in the first 5 hours or so, but ultimately, I am glad I decided to stick with it.  The boss fights were the highlight of the game and there are plenty of them.  The stiffness of the movement is fixed after getting one of the essential upgrades, but it feels kind bad to move around before that point.  I am a huge fan of precision platformers and this game has some of the WORST platforming in any game I have ever played and there is wayyy too much of it scattered around the world.  I wouldn't say this is a must-play game by any means, but I would recommend it for people who like 2D Souls-like experiences or for fans of Metriodvanias that focus on combat and finding secrets.  I was actually impressed at how many secrets are in the game and that kept me interested throughout my playthrough.  The world design was quite cool as well, with the scenery being breathtaking yet on the verge of ugly simultaneously."
212828965,76561198399375565,0,240,41.8,41.8,True,8,0,0.604962408542633057,0,True,False,False,english,2025-12-08 05:00:33,2025-12-08 05:00:33,"GRIME is a 2.5D Metroidvania where you play as Akhlan, an entity which can absorb elements and enemies in a huge world filled with unknowns.  The game offers a huge interconnected world with secrets to discover around every corner as well as platforming sections that will test your platforming skills.  There are many different kinds of weapons from swords, to heavy 2H to scythes. You choose depending on your own style with each having their own aesthetic look. Super solid controls and combat system where you can absorb enemy attacks to destroy them or repel/parry enemy attacks and counter back.  There is also stats system which you collect mass from defeating enemies or crushing remains found throughout the world and then use this mass to level up your stats. Each weapon has their own scaling. You also unlock weapon upgrades later on in the game after you progress few bosses.  The OST was very nice, for each zone it gets even better, gets intense during boss battles.  The boss fights were a real highlight with each of them offering a real challenge, where you to either parry, jump, dodge each attack thrown at you while at the same time managing your stamina bar which can prove challenging at times. I loved each single boss fight the game has offered.  I'm really looking forward to GRIME 2 which is already in the works by the same studio and hopefully will release in 2026. Hats off to the Devs and team putting in the time and effort into this and the upcoming sequel.  It's really recommended and a must play for any metroidvania genre fans out there.  Overall Rating 10/10"
212817068,76561198201267150,256,44,26.8,26.8,True,0,0,0.5,0,True,False,False,english,2025-12-08 00:14:03,2025-12-08 00:14:03,Very faithful to the Souls formula it tries to apply and with its own unique twist in the form of the absorb parry system and prey traits. A very enjoyable and beautifully dark metroidvania.
212787685,76561198799611696,87,36,30.1,30.1,False,10,2,0.536263346672058105,0,True,False,False,english,2025-12-07 16:26:35,2025-12-07 16:26:35,"I had strong mixed-up feelings about this game all along my playthrough.  Loved the general athmosphere and found the cryptic story quite interesting. The fights, especially against bosses, can be though but fair.  The cons got the better of me in the end :  - Backtracking was never something I enjoyed in this game, a shame since it is a huge part in the metroidvania genre  - Exploration in general was not fun, why so dark in most areas ? Having to jump blind and hope that there will be something to land on... nope it was a game mechanics I already did not enjoy in the 1990's games  - Several bugs during my run where I finished stuck into a wall and had to destroy the vessel in order to go back to the last checkpoint  I don't regret having discovered the Grime world but will not recommend it to anyone wanting to try a 2D metroidvania / soul like."
212732519,76561198027027643,2141,20,35.3,35.3,True,0,0,0.5,0,False,False,False,english,2025-12-06 23:24:40,2025-12-06 23:24:40,"I quite enjoyed this game, both the combat and platforming was fun and responsive (except walking for some reason, but i literally only had to do it 3 times the whole game)."
212623313,76561198025105109,16,1,21.1,14.3,True,2,0,0.552438199520111084,0,True,False,False,english,2025-12-05 16:07:59,2025-12-05 16:07:59,Excellent atmosphere and very creative combat and parrying system. Unique vision and very rewarding boss battles. A-Tier Metroidvania
212605358,76561199184955241,0,3,61.3,54.8,True,0,0,0.5,0,False,False,False,schinese,2025-12-05 10:29:55,2025-12-05 10:29:55,"刚把这游戏白金了，评价为8/10 玩这游戏很需要对电波，因为本作有体力条，战斗系统和格挡弹反过于强相关。玩家需要通过格挡吸收敌人才能回血、回复体力条，吸收3次回一次血，格挡成功才能恢复部分体力，对习惯闪避的玩家比较折磨。加上存档点过少，探图很容易翻车接着三百六十五里路，后期又有很多怪和boss不能被吸收就就让人很迷惑。好在多周目主角性能会成长得很恐怖，可以降低探索难度。 boss战是一大亮点，这游戏的某些boss战目前属于无代餐级别（尤其是梦魇和最终表演）。美工非常独特，二代截图能让不玩的朋友一眼就认出是续作。从后期dlc加入的花园和子体温床可以看出制作组的建模水平在进步，但花园没有boss战加上子体温床全是跳跳乐就让人很迷惑（加上那个被棍木抛弃的作品）。我只能说，跳跳乐过多是这游戏的一大减分项。[strike] 以及拜托不要在隐藏或者跳跳乐奖励里面塞垃圾了给点装备和衣服吧 [/strike] [strike]怀疑二代的跳跳乐会更多，希望不会如此[/strike] [spoiler] 因为黑洞头看起来还是蛮涩的[/spoiler]，我还是可以给到8分"
212571872,76561198099797012,87,4,44.1,44.1,True,0,1,0.5,0,False,False,False,english,2025-12-04 21:06:43,2025-12-04 21:06:43,One of the best games I've ever played. Could never get into Hollow Knight which this game shares many similarities with. It fixes everything I didn't enjoy in HK while accompanying it with beautiful visuals and premise I've never seen before.  Play; If you love surreally crafted visuals and story. If you love to craft and hone your own play style as the game offers so many weapons and abilities to fit exactly what you need while being playable. If you want very challenging but extremely rewarding experience.  Soulslike metroidvania I was always looking for.
212402113,76561199700574692,99,22,33.7,33.7,True,0,0,0.5,0,False,False,False,schinese,2025-12-02 12:41:05,2025-12-02 12:41:05,跳跳又多又臭像老太太的裹脚布
212226916,76561198029975962,1572,111,18.4,18.4,True,1,0,0.523809552192687988,0,False,False,False,english,2025-12-01 04:29:15,2025-12-01 04:29:15,"I normally don't too many metroidvanias style games but after the first hour I was hooked. This is more of a soulslike metroidvania but you don't drop your mass (upgrade mats) upon death so definitely not as frustrating. The combat was pretty solid and the boss fights were never too difficult or total pushovers. Good amount of enemy variety and a decent amount of unlockables. Think the only thing I got annoyed with was trying to find my way around levels so really much more of a skill issue lol. Wait for a sale but if you have it already, try it out. Enjoy!"
211776457,76561199243629321,0,10,42.3,42.3,True,0,0,0.5,0,False,False,False,english,2025-11-30 00:39:04,2025-11-30 00:39:04,This game is an absolute must play for anyone who enjoys the metroidvania genre! Very well done! Highly recommend!
211731514,76561198408969580,22,3,48.7,48.7,True,0,0,0.5,0,True,False,False,english,2025-11-29 20:18:16,2025-11-29 20:18:16,Very good.
211551566,76561199638785707,52,2,23.5,16.4,True,0,0,0.5,1,True,False,False,schinese,2025-11-29 02:50:05,2025-11-29 02:50:05,心情很沉重，因为二周目的档没了（也不知道为啥），只有一周目结束时的档，十几个小时白打了，我还没和梦诞恐魔过招就这么结束了？ 但游戏还是很对我电波的，一些缺点还能接受（但是一周目开荒确实有点难受），二代的demo体验下来相当不错，会支持的。类银爱好者建议试一试。当然这个一代也值得尝试，越到后面越好玩。
211510273,76561199099045993,40,5,27.9,27.7,True,0,0,0.478947341442108154,0,False,False,False,english,2025-11-28 21:50:38,2025-11-28 21:50:38,peak
211501967,76561198120841401,555,14,41.9,28.8,True,2,0,0.526600539684295654,0,True,False,False,russian,2025-11-28 21:02:23,2025-11-28 21:02:23,Просто пройдите эту игру. Это одна из лучших игр в моей жизни.
211467389,76561198995155169,0,37,36.0,36.0,False,1,0,0.506172835826873779,0,True,False,False,schinese,2025-11-28 18:05:02,2025-11-28 18:05:02,"一共玩了两个周目，二周目最终全收集通关用了15小时，个人觉得是比较好玩的，但是绝对不会推荐给任何人。  1、战斗部分。本作为有体力条限制的类魂恶魔城，可以对标盐与避难所，同时核心机制是弹反且强制使用，不存在不弹反可以正常击败的boss，加上体力条的限制，本作的战斗可以说完全建立在了能对boss的每一招进行【正确】应对的前提下。如果boss的黄光攻击没有拉扯成功，白光攻击没有弹反成功，红光攻击没有闪避成功，玩家就会白白浪费资源最终滚雪球致死，这在我的一周目玩力量号的情况下尤为严重。同时，所有敌人的攻击都飘忽不定，打人跟打棉花似的看不出出手动作，出招也没有逻辑（点名表扬劣等混合物和施德拉，这两人抬手你不背板完全看不出来他两到底想干嘛），战胜一个每个boss几乎靠的都是背板。  2、地图探索。究极大粪，整个游戏里百分之90以上的收集物都没有任何卵用，为数不多得到的武器和护甲，武器在两把体力和生命加成的逆天武器的衬托下显得都低人一等，我一周目玩力量号拿着大锤打出来的伤害还不如我二周目拿那把生命加成的小镰刀戳人疼，我拿小镰刀还能血量50绿条35。护甲在整体游戏偏黑暗的环境下基本看不出有什么区别且属性加的也是蚊子腿，纯收集。剩下的那些个投掷物什么短时间加属性的消耗品什么血瓶什么强化石更是时尚小垃圾，跟着up主的全收集攻略跳台子半天捡到个强化石3给我逗乐了。同时，为什么我要玩两个周目呢？因为tm这个游戏刚开始居然连传送功能都没有，想解锁传送功能还需要去特定的某个地下地图打赢一个还不怎么好打的boss才能解锁。当初刚发售的时候能玩下去和现在不看攻略能玩下去的人都是赤了怎样的一坨可想而知。  3、剧情音乐与美术。音乐一般般基本上等于不存在（这个游戏除了过剧情之外有音乐吗？），美术相当不错，质量在同类型游戏中算最顶的那档，主角吸收boss的那种摧枯拉朽的感觉我很喜欢。剧情方面，是真正意义上的【我不知道我是谁，我也不知道我在哪，我只知道我要大开杀戒】，我们的主角唯一的目的就是把整个游戏里活着的所有东西吞噬掉，主线剧情非常好懂。但是除此之外的npc以及世界观的塑造基本上灾难级别的，先不说整个游戏里就没几个有戏份的npc，这帮人还各个不说人话当谜语人，要不是跟着人家全收集up主走听了一遍剧情也看不懂这些人在干啥。  4、跳台子部分。银河恶魔城不得不品的一环，但是本作的跳台子玩的还是比较爽快的，虽然主角拖着一副类魂游戏的半残性能，但是在跳台子方面有着冲刺、钩爪、拉扯平台、缓降等等能力的加持，即使是游戏中最难的【被抛弃的作品】也并不能困扰住有一定水平的玩家。但是，和曾经我也提出过批评的另一款横板跳跃游戏【超级忍】一样，本作跳台子的问题是它设计的太密集太多了。平台跳跃关可以有也可以存在空洞骑士苦痛之路、本作的被抛弃的作品这样的纯跳跃关，但是你一个类魂游戏在所有地图都塞了一大堆的没一个小怪的纯跳台子这谁顶得住，前面的地图探索起来还比较有意思，越往后的地图那敌人越少全是跳台子。子体温床那我都感觉我是不是进入的不是始祖的子宫而是直肠，全是大粪跳台子。跳完一长段最后奖励你一块强化石3，气笑了直接。  综上所述，本作是一款硬件质量不错，需要有一定银河城与类魂游戏基础才能游玩的有门槛的作品，游玩体验到刻型者宫殿的中期体验会相当不错，然而后期那些个遍地垃圾的跳台子地图毫无乐趣可言，且整体游玩下来刚需攻略的帮助，环指学徒的评价是B，赤石仙人可以玩但不推荐给其他人。"
211428323,76561198109156775,171,43,34.2,34.2,True,0,0,0.50265955924987793,0,True,False,False,english,2025-11-28 15:23:34,2025-12-06 23:44:45,"To keep it short: game's good except for game design. It's a platforming heavy metroidvania, which is nice,. This would be a mediocre rated review if it was possible."
211319808,76561198353196946,0,21,132.9,130.1,True,0,0,0.5,0,True,False,False,english,2025-11-28 02:42:24,2025-11-28 02:42:24,Thee best metrovania I've ever played. Infinite gameplay thanks to the dev's genius of not locking a weapon or perks upgrade limits.
211319051,76561197970632266,621,81,14.2,14.2,True,0,0,0.5,0,False,False,False,english,2025-11-28 02:35:22,2025-11-28 02:35:22,"Very good metroidvania. Very big map with a lot to explore. A lot of challenges but not too punishing for failing. A bit lacking in music but good ambiance overall. The weapon speed overall made it seem that anything below 'average' speed is not worth it in terms of DPS compared to faster weapon, especially when it takes almost a second to swing and enemies move around.  Even for the few downsides, I enjoyed playing it and would recommend it."
211288352,76561198809206874,128,9,37.6,37.6,True,0,0,0.5,0,False,False,False,polish,2025-11-27 22:52:28,2025-11-27 22:52:28,"Super gra! polecam każdemu kto uwielbia souls like! Graficzka super mapa bardzo wertykalna... oooo i ziemniaczki przyszły. ZW, dokończę recenzje jak zjem ziemniaczki"
211232153,76561198333832506,1242,10,1.9,1.6,False,1,1,0.455591320991516113,0,False,False,False,english,2025-11-27 18:14:32,2025-11-27 18:14:32,"Literally parry the simulator.   It's not exactly hard coming from some that 100% silksong, it's just boring. Not to do comparisons, but I just did the first major boss fight and it was completely underwhelming. All you do is parry each hit and your dash phases through every attack so it's pretty simple. Maybe it gets more challenging later on but I'm not sure I want to keep playing to find out..."
211094306,76561198037940027,1819,635,0.1,0.1,True,0,0,0.5,0,True,False,False,russian,2025-11-27 07:24:29,2025-11-27 07:24:29,"Дизайн наносит урон глазам по началу, а так нормально, привыкаешь.  Рекомендую коллекционерам данного жанра."
210979977,76561198284126513,0,32,19.7,19.7,True,0,0,0.5,0,True,False,False,spanish,2025-11-26 19:59:57,2025-11-26 19:59:57,"He tardado en completar la primera run, a falta de NG+ que es donde esta la mandanga, un juegazo y un metroidvania muy sobresaliente. Le falta un poco de peso en el combate con armas, pero se nota que es algo que están corrigiendo en la segunda entrega.  Necesitaría sustancias ilegales para hablar de mis lecturas de este juego"
