review_id,steam_id,num_games_owned,num_reviews,playtime_forever_hrs,playtime_at_review_hrs,recommended,votes_up,votes_funny,weighted_vote_score,comment_count,steam_purchase,received_for_free,written_during_early_access,language,date_created,date_updated,review_text
201593516,76561198143674832,411,72,25.6,25.6,True,5,2,0.572483479976654053,0,True,False,False,russian,2025-08-06 20:28:42,2025-08-25 18:16:50,"Игра неожиданно сложна, настолько, что она тебя даже не злит. Осознание того, что ты даже не представляешь, когда будешь близок к победе - напрочь лишает тебя всех эмоций и заставляет просто смиренно траить... босса, паркурную секцию...  Игра сеттинга ""Любовь, смерть и роботы"" - сюрреалистично, странно, абстрактно. Для меня лично это треш придуманный травокурами, я не любитель такого, мне куда роднее что-то более приземленное, с людьми, с замками и адекватными диалогами, а тут же... тут для любителя.  Играется прикольно, несмотря на не понравившийся стиль, в игре привычные виды холодного и дробящего оружия, много брони, доступ к кастомизации под себя, любопытная прокачка и интересный набор способностей. Всё это в купе дарит игроку довольно интересный игровой процесс и гибкость в бою.  Парадокс, мне игра больше наверное не понравилась, чем понравилась, но тем не менее хочется ей поставить положительный отзыв, потому что самобытно. Сложные боссы, душные локации, противные враги, отсутствие нормальной логистики, а во второй половине тебя начинают испытывать адским паркуром, во время которого тебя будто невидимый бес держит за горло, не позволяя сделать вдох - в общем есть всё то, что делает из метрошки, хорошую метрошку :D  Но желания пройти ещё раз(что свойственно жанру) - его нет, в пиз***у)"
201557392,76561199056018046,0,53,40.6,9.2,True,0,0,0.5,1,True,False,False,english,2025-08-06 08:57:01,2025-08-06 08:57:01,♥♥♥♥♥♥♥♥ this soup is good
201552373,76561198019942613,0,9,37.8,37.8,True,0,0,0.5,0,True,False,False,english,2025-08-06 06:27:56,2025-08-06 06:27:56,"Grime is an interesting 2D souls-like/metroidvania type game, which I would almost put in the same vein as Hollow Knight (HK) and Nine Sols (NS). It definitely has a high emphasis on parrying and on boss fights, but compared to most other games shines with its dedication towards the NG+ experience. While I think the game needs a bit to get warm, when it hits, it hits you hard.   Another focus of Grime (similar to HK and NS) is the platforming. Which, like most 2D metroidvania games it takes some time to get good and really starts to make a lot of fun when you unlock most of your abilities. Grime finds a good balance in my opinion with neither being too hard or two easy, in terms of platforming. It does not reach the levels of HK path of pain (even though there is one section which seem to get a lot of inspiration from the path of pain), but it definitely harder than NSs platforming.   In terms of boss fights it is also not much behind the likes of HK or NS. It starts of good, being followed by some easier bosses, but towards the end gets a bit harder. And then the NG+ spices up everything again. The game doesn’t really shine in boss variety, but definitely in replayability of these bosses with increased difficulty. The determination towards replayability is the most fascinating thing about Grime. The devs really made the NG+ an interesting and worthwhile experience and didn’t just pump up all the enemies’ numbers like certain other devs (Fromsoftware). They upgrade every enemy in the game (or at least almost every enemy), to make their attacks a bit different and harder to avoid, added new phases to bosses and even made a challenging last boss fight only playable in the NG+. That’s real dedication. In addition, you keep all your movement abilities which makes traversing the map easier. It always bothered me when playing games like HK or NSs, that after finishing the game and starting a new character the start feels so slow compared to the end of the game. Since this option somewhat breaks some platforming in the beginning of the game, it seems to me this was implemented to cut down the time between boss fights, which were the real focus in the NG+ experience.   One, maybe a bit odd choice of Grime was to lock certain abilities behind optional boss fights. For example, the ability to warp between bon fires is only unlocked after defeating a boss which is not necessarily on the main path. The boss isn’t hard to find but it’s a bit strange that such a crucial ability is not after a mandatory boss fight. I believe this was done because some bosses and areas where added after the launch of the game, and maybe at the beginning the warp ability wasn’t implemented in the game (which probably lead to people complaining about backtracking… I would too). The way it is, exploration is definitely more rewarding since you are able to find very important things by doings so, but I can also see it being very frustrating if you miss abilities like warping.  To summarize, Grime maybe has some minor flaws and maybe lacks a bit in boss variety, but it definitely makes up to it by its dedication to people who enjoy its combat and boss fights. Its one of the best 2d souls-like games I played and almost reaches the upper echelon, that is Hollow Knight and Nine Sols."
201551978,76561198033238453,1960,245,13.3,13.3,True,0,0,0.5,0,True,False,False,english,2025-08-06 06:17:11,2025-08-06 06:17:11,"Very good game, sometimes challenging, but is worth it. ^^  Graphics: 7/10 Soundtrack: 8/10 Story: 8/10 Gameplay: 9/10 Overall: 8/10"
201526812,76561198994695830,0,9,2.1,1.2,True,0,0,0.5,0,False,False,False,german,2025-08-05 20:25:29,2025-08-06 16:44:42,7/10
201483303,76561198134845965,0,10,25.8,25.8,True,0,0,0.5,0,True,False,False,english,2025-08-05 06:07:27,2025-08-05 06:07:27,"After a break at first before the dlcs were added, I wasnt keen on getting back into the game. Going through the backlog of games that I have and actually trying to finish them, well... This game is beautiful in every sense of the game! The art, soundtrack, world, writing, and the gameplay are all amazing! Other metroidvanias can get tedious, but for whatever reason I just wasnt annoyed when playing this game. Last note, the dlcs including the bosses are *chef's kiss"
201470357,76561198380050519,0,6,49.8,49.8,True,0,0,0.5,0,False,False,False,brazilian,2025-08-05 00:33:32,2025-08-05 00:33:32,:)
201465804,76561199215180503,176,2,24.7,9.9,True,0,0,0.5,0,True,False,False,spanish,2025-08-04 22:51:31,2025-08-04 22:51:31,"Mix entre souls borne y metroidvania, muy recomendado"
201454326,76561198806988180,155,18,19.2,18.4,True,0,0,0.5,0,True,False,False,turkish,2025-08-04 19:19:44,2025-08-04 19:19:44,"just play it,its good"
201450174,76561199800436522,0,3,25.1,15.5,True,0,0,0.5,0,True,False,False,english,2025-08-04 18:08:38,2025-08-04 18:08:38,"Fun, parry focused mv based in a weird world that I don't fully understand but looks great nonetheless."
201422006,76561199154809333,22,3,20.7,19.9,True,0,0,0.5,0,True,False,False,english,2025-08-04 09:30:43,2026-02-22 19:00:44,can't sex the black hole.
201374434,76561199081956105,34,22,34.9,34.9,True,0,0,0.5,0,True,False,False,english,2025-08-03 16:43:21,2025-08-03 16:43:21,Great
201328398,76561198026571935,0,23,50.5,49.9,True,0,0,0.5,0,True,False,False,english,2025-08-03 02:03:16,2025-08-03 02:03:16,A well done castletroid.  Thank the maker a sequel is nigh.
201305500,76561198072253387,250,134,37.1,36.9,True,0,0,0.5,0,True,False,False,english,2025-08-02 18:43:37,2025-08-02 18:43:37,"My only regret is not having played Grime sooner.  It is an absolutely excellent game combing brutal and satisfying combat, with buttery smooth platforming.  I played nonstop until the very end and there's also New Game Plus!?!?  Cannot recommend this game enough to people who enjoy very good and challenging metroidvanias."
201273027,76561198316599903,0,36,27.3,26.8,True,0,0,0.5,0,True,False,False,schinese,2025-08-02 09:43:42,2025-08-02 09:43:42,合格的代餐
201245987,76561198292460835,0,8,14.2,14.2,True,0,0,0.5,0,True,False,False,brazilian,2025-08-01 23:29:37,2025-08-01 23:32:10,"joguin bala  mistura elementos de souls like com metroidvania. Da pra fazer builds mas nada muito complicado, tem uma boa diversidade de armas e armaduras até e uma jogabilidade bem fluida.  os desafios de plataforma me lembraram muito Rayman Legends, nada muito dificil e bem divertido. Os boss são bem legais e a dificuldade ta na medida certa.  em relação a exploração do mapa vc precisa saber de algumas coisas q podem te chatear: - Quando vc morre normalmente vc volta bastante no mapa, tendo q passar por muita coisa novamente, mas  é bem facil passar correndo pelos inimigos caso vc queira; - Antes de vc desbloquear o teletransporte entre os checkpoints vc tem q andar bastante pra ir para os pontos de interesse;  Enfim, 12 horas bem jogadas, valeu a pena"
201129901,76561199187887909,0,14,23.1,3.0,True,0,0,0.5,0,True,False,False,schinese,2025-07-31 09:57:37,2025-07-31 09:57:37,好玩
201118669,76561198331524701,0,54,23.9,23.9,False,1,0,0.5,0,False,False,False,schinese,2025-07-31 05:14:34,2025-07-31 05:14:34,epic白送，这样，加上我掏钱买的steam版，就是双份痛苦加受罪
201100053,76561198204337384,58,12,1.4,0.5,True,0,0,0.5,0,True,False,False,ukrainian,2025-07-30 22:06:42,2025-07-30 22:06:42,"Я опишу цю гру так: якщо ви бажаєте відчути як це жити на іншій планеті - раджу. Після неї приємно вертатися додому. Тут багато поганого: росія, наприклад. Але загалом це дім, а от Grime, по відчуттям, це дійсно щось інше.  P.S. Не бачу особливого сенсу розповідати про геймлей, оскільки це в цілому те, що і заявлено, трошки соулслайк, трошки метроїдванія."
200979838,76561197984541245,1957,37,14.1,14.1,True,2,0,0.539975881576538086,0,False,False,False,english,2025-07-29 10:34:21,2025-07-29 10:41:48,"Smooth gameplay with only a few bugs/hiccups. The combat is fun and the boss fights are just the right level of difficult to make victory really feel good. Exploration is good, but the map needs work... wandering around each zone blindly trying to find a beacon so you can keep some sense of location permanence is so stupidly frustrating.  The setting is surreal and intriguing, but there is not nearly enough to latch on to in regards to the story it is trying to tell. I respect the attempt to tell the greater story surrounding our character and the world they're born into through such a limited perspective, but this game really asks too much out of the player when it comes to unraveling the fabric of the plot and setting. The entire experience left me a little frustrated with how deliberately obfuscated it tries to be.  Otherwise I had a great time with it and look forward to the sequel."
200972476,76561198357974418,0,102,18.3,18.3,True,0,2,0.5,0,False,False,False,english,2025-07-29 07:51:12,2025-07-29 07:51:12,I am filled with an overwhelming desire to consume rocks. What do I do with this
200902087,76561198049858767,204,2,19.8,19.8,True,0,0,0.472440958023071289,0,True,False,False,russian,2025-07-28 09:23:56,2025-07-28 09:23:56,"левел дизайн не защел. без карт из интернета долгий круговорот по миру, а если еще не найдешь маяки то еще круговорот в потемках . рекомендует для любителей страдать и играть на двух мониторах одновременно: 1 игра , 2 гайд к игре/карта"
200775996,76561198067182586,0,2,38.5,38.5,True,0,0,0.5,0,False,False,False,french,2025-07-26 18:10:38,2025-07-26 18:10:38,"Very good game. I found it a bit hard to grasp at the beginning, especially with the stamina ressource (the action you do like dash, attack or jump consume it and when you run out of stamina you have to wait for it to reload again) but once you get used to it it's pretty enjoyable to play with. One other nitpick i have is some progression points of the game were to me a bit unlogical so i'd suggest to check for a soluce/walkthrough if you struggle to know what you should do next at some points.  Other than that, the gameplay was very good, the art was really great, it took me around 20 hours to finish my first run and 38 to do all the achievements. New game + is pretty nice since it makes the game a bit harder, monsters and bosses have additional skills. The bosses have been the highlight of the game for me, they're pretty hard while still being fair, learning how they work to beat them has been a very nice experience.   To conclude if you like metroidvanias you should definitely like this game, the beginning might be a bit rough but it's worth it."
200744998,76561199764671041,0,4,24.2,3.3,True,0,0,0.5,0,True,False,False,brazilian,2025-07-26 11:01:45,2025-07-26 11:01:45,"eu não sei como descrever de outro jeito então vai ser assim mesmo, QUE JOGO BOM VELHO, ESSE JOGO É UMA PÉROLA PERDIDA NA STEAM CARA, EU RECOMENDO ESSE JOGO PARA QUALQUER PESSOA QUE EXISTA NA FACE DESSA TERRA"
200690527,76561198287157479,0,32,6.8,6.8,False,5,0,0.560993373394012451,0,True,False,False,koreana,2025-07-25 17:54:33,2025-07-25 17:54:33,"왠만하면 게임을 끝낼려고 노력하는데 게임성 레벨디자인 다 좋게 만들어놓고 이동관련에서 점수를 다 깎아먹었다. 다른장소로 넘어갈때 세이브 놔두는게 그렇게 싫었던가 개발자는? 어떻게 한번죽으면 전맵에서 달리면서 죽은데까지 와야하는거냐 개발자야 이게 게임이냐"
200689661,76561199146665139,0,4,41.0,41.0,True,0,0,0.5,0,False,False,False,italian,2025-07-25 17:41:34,2025-07-25 17:41:34,"My final verdict for the game is a solid 8-9 out of 10. SOME SPOILERS AHEAD  PROS: -satisfying combat system -the parry is quite unique as it's both a defensive and offensive tool -the mobility skills are nice and play well around the concept of a ""black hole"" being -the exploration overall is pretty good, and rarely felt frustrating or uninspiring -bosses are nice to fight and master, and there are basically no runbacks (provided you unlocked available shortcuts) -customization is really nice, as you can combine weapon, armor set and traits that best suite your playstyle -the art direction is amazing and all areas have their own unique vibe -while the plot is still told the usual ""souls way"", the general theme of the game can be understood fairly easily -in terms of performance, the game played almost flawlessly for me with no bugs, glitches or crashes encountered during 2 playthroughs. -the NG+ retains mobility skills, allowing you to sequence break and reach all areas much faster; enemies have an ""enchanced moveset"" (bosses as well), which encourages replayability. -For platform fans, the last update introduce a ""Path of Pain"" area that rewards players with a very cool (and unique) weapon that does a lot of damage.   CONS -Apart from 2 weapons and the ability to further power up weapons and traits, the NG+ doesn't seem to offer much -The NG+ exclusive boss is really fun to master, but the fact he doesn't drop his weapon (but just his armor set, which has NO USEFUL PASSIVE ABILITY) was quite a letdown -The game breaks a staple of the genre by offering 2 endings which can be obtained regardless of how much you explored into the game, and considering all the stuff going on with the Child, that seems like wasted potential to me. -The fact that both the sprint and walk action are tied to the same input means that in order to change them you have to use a pearl to remove the trait otherwise you won't be able to sprint (run)."
200666120,76561198049243092,2524,42,38.9,37.3,True,4,0,0.58249741792678833,0,False,False,False,russian,2025-07-25 12:16:17,2025-07-25 12:16:17,"Отличная метроидвания с небольшими вкраплениями соулс-лайков. много оружия каждое со своей спецификой, возможность поглощать врагов с последующим получением доп способностей. прокачка и покупка предметов как в ДС, за ""души"", которые не теряешь после смерти. Графика не самая топовая, но все равно приятная. При прохождении НГ+ боссы и рядовые враги получают доп атаки и умения. Собрать все ачивки не так и сложно, мне это почти удалось за прохождение основной игры и НГ+. Так же хочется отметить мрачный сюрреалистичный мир с запутанным и непонятным лором. В общем рекомендую."
200492986,76561198018354662,259,14,26.9,26.9,True,2,0,0.54356849193572998,0,True,False,False,english,2025-07-24 06:06:25,2025-07-24 06:06:25,"Great Soulslike metroidvania, up there with blasphemous."
200463741,76561198839371120,0,5,59.2,21.1,True,0,0,0.5,0,True,False,False,russian,2025-07-23 20:54:45,2025-07-23 20:54:45,"шикарная игрушка, очень нравится. очень атмосферно"
200456980,76561199139995102,91,2,57.1,57.1,True,2,0,0.527559041976928711,0,True,False,False,russian,2025-07-23 18:52:45,2025-07-23 18:52:45,"Grime - метроидванию-соулслайк со своей уникальной атмосферой всепоглощающего разрушения и упадка в который вы падаете, чтобы понять, постичь и поглотить всё до чего сможет дотянуться ваша любопытная чёрная дыра  Хорошая метроидвания с прикольными локациями и со своими достаточно интересными и не сложными механиками (но если вы захотите заполучить МЕЧ-КОСУ, то ваша вера в адекватность разрабов может чуть пошатнуться)  Достойный представитель соулслайков с хорошими боссами и со своими по истину новыми механиками, где поглощение ни в коем случае не копирка парирование, а нечто новое, хоть и недалеко отходит от него по смыслу, также ещё можно отметить притягивание, что тоже достаточно забавная штука  Самое главное - это навыки и способы их приобретения в этой игре, типо ""Перед тобой ходит вкусная и опасная бяка которую можно съесть,  а в ней валяется навык на более приятно съедение всех остальных"", и бяка выполнила свою цель, и вы сыты  Я рекомендую это игру, у неё есть свои косяки, но их не так много и будем надеяться что продолжение сможет развить идеи и механики первой части, ну а пока что можно пойти в Rain World, они как раз в комплекте продаются..."
200373825,76561198316168776,0,10,42.0,41.7,True,0,0,0.5,0,True,False,False,koreana,2025-07-22 14:47:23,2025-07-22 14:47:23,확실한 피격범위와 패턴 그리고 다양한 파훼법. 정말 깔끔하고 재미있는 보스전들이었습니다.
200352995,76561198121273583,0,10,17.2,17.2,True,0,0,0.5,0,True,False,False,english,2025-07-22 06:58:33,2025-07-22 06:58:33,"A really unique Metroidvania that has you pretty much play as Void Fiend from RoR2, and mixes in Sekiro parrying mechanics. Def worth a play through for sure, and love the atmosphere of the game even though I have no clue what is going on!"
200349321,76561199508868025,0,7,40.1,34.8,True,0,0,0.5,0,True,False,False,english,2025-07-22 05:12:42,2025-07-22 05:12:42,"incredibly beautiful visually, and the music is the best of any game I've played, mechanics are sound (mostly, it can be a bit iffy at times) a 9.5/10 for sure. Also NG+ changes a lot of the enemies and bosses attacks so it's a lot more interesting than them dealing more damage and beefing up their health bars, gotta love little details like that."
200283396,76561198082887019,0,91,5.9,5.9,False,0,0,0.5,0,True,False,False,koreana,2025-07-21 06:19:50,2025-07-21 06:19:50,똥겜
200210914,76561198098869833,202,1,6.5,4.5,True,0,0,0.5,0,False,False,False,german,2025-07-20 06:41:05,2025-07-20 06:41:05,Tolles souls-like metroidvania in einem skurilen setting.
200155828,76561198979412239,114,48,31.2,31.2,True,1,0,0.523809552192687988,0,False,False,False,schinese,2025-07-19 13:21:51,2025-07-19 13:21:51,"这游戏前期跑图巨折磨，原因一是不熟悉弹反，跑图过程基本回不到血。第二是地图都是石头，没有明显参照物，在没开信标时很难记住地图，第三隐藏巨多，东西都是蚊子腿，很少有好东西！  不过中期体验开始变好，发现弹反性能的强度，熟用之后受苦变少，而且基本没有死亡惩罚。  探索地图像解密一样，因为互动没有提示，经常以为走不了错过能走的地方，又走着走着发现原来这种地方可以用这个能力解决，也算是一点小惊喜。  综合体验下来还是一款不错的游戏，虚构的世界观设定，特殊的吸收怪物玩法，虽然有一些小问题影响体验，不过还是瑕不掩瑜的！"
200089798,76561198273174480,543,50,0.8,0.5,False,6,0,0.505924463272094727,1,False,False,False,english,2025-07-18 15:33:23,2025-07-18 16:32:25,"Probably a good game but there's tons of stuttering throughout just the first 30 minutes. There's inexplicable and consistent frametime spikes when performing certain actions and the camera and character don't appear to animate smoothly, presenting as stutter also. This is at 60fps on both my RTX 3060 (12GB) + i5-12400F PC and Steam Deck. Just a really unpleasant experience."
200053853,76561199778103709,148,41,5.0,5.0,True,0,0,0.5,0,False,False,False,schinese,2025-07-18 02:31:54,2025-07-18 02:31:54,"与其说建模好丑不如说是画风好丑，就导致对这游戏喜欢不起来 格挡手感不错，仅次于九日，正反馈还行 没玩过九日的去玩九日，这个当代餐"
199884388,76561198148974553,0,103,39.0,30.1,True,2,0,0.52173912525177002,0,True,False,False,english,2025-07-15 20:02:19,2025-07-15 20:02:19,Absolutely phenomenal game one of the best metroids out. Looking forward to Grime 2. easy 9 / 10
199794529,76561198970796516,120,8,23.8,23.8,True,0,1,0.5,0,True,False,False,brazilian,2025-07-14 16:32:42,2025-07-14 16:32:42,você tem uma cabeça de buraco negro
