review_id,steam_id,num_games_owned,num_reviews,playtime_forever_hrs,playtime_at_review_hrs,recommended,votes_up,votes_funny,weighted_vote_score,comment_count,steam_purchase,received_for_free,written_during_early_access,language,date_created,date_updated,review_text
222315132,76561197994585644,0,20,1.6,1.6,False,3,1,0.420565813779830933,0,True,False,False,english,2026-04-02 09:51:29,2026-04-02 09:51:29,"Incredibly light feeling combat, with wimpy sound effects. Combat is centred around a very easy to perform parry (which you have to use to heal), but the parry sound/animation is very unsatisfying.  Couple that with braindead enemy AI and an incredibly boring aesthetic, and I've lost all desire to continue."
222306232,76561199563525910,0,1,105.7,8.2,True,0,0,0.5,0,True,False,False,english,2026-04-02 05:58:03,2026-04-02 05:58:03,"Very atmospheric and fun as a semi-casual platformer.  Unique concepts that are not spoon-fed to players, like many games do, leading to lots of moments of discovery.  Works great with a controller, like a side-scroll metroidvania should be, which is the only time I use one.  I am looking forward to finishing this title and then proceeding on to the new release in the series. (Game was purchased and I am not AI or compensated)"
222303864,76561198078135897,0,18,17.8,3.1,True,0,0,0.5,0,True,False,False,english,2026-04-02 04:52:22,2026-04-02 04:52:22,amazing game close one to hallowknight and blasphmeous
222296826,76561198103344867,0,8,29.0,29.0,True,1,0,0.523809552192687988,0,True,False,False,english,2026-04-02 02:00:52,2026-04-02 02:00:52,"solid platforming, challenging but fair bosses, ideal runtime for me."
222289046,76561198004555239,0,317,18.8,9.9,True,0,0,0.5,0,True,False,False,english,2026-04-01 23:30:06,2026-04-01 23:30:06,"This game is truly a hidden gem. Fantastic stylised art. Great gameplay and worldbuilding. Interesting variety of enemies and weapons. I have been meaning to give this a recommended review for a long time but now Grime 2 is out I think it is time to finally try to finish this game and then play the sequel. Either way I highly recommend this for any fans of metroidvania, particularly for its souls-like influences with the weapons system.  As an aside, I really love the Ardor system. Makes dying feel less punishing but still has a real penalty."
222285158,76561197971356176,0,15,25.4,8.3,True,0,0,0.5,0,True,False,False,english,2026-04-01 22:22:14,2026-04-01 22:22:14,"I was late to this one, but its definitely a top tier souls like metroidvania.  As Souls and Hollow Knight games fan, i can safely say that this can stand neck to neck with them."
222283202,76561198058931793,0,6,42.7,32.8,True,0,0,0.5,0,False,False,False,english,2026-04-01 21:47:49,2026-04-01 21:47:49,"Loving this game, It will kill you. A lot. But you'll keep coming back for more."
222270138,76561198200794886,313,51,31.7,31.7,True,2,0,0.545454561710357666,0,False,False,False,schinese,2026-04-01 18:21:31,2026-04-01 18:21:31,地图设计很好，但游戏内地图差，不显示近路和隐藏  主打弹反，平a和冲刺消耗体力，前期体力条短不适应弹反时有点牢  后期有纯跳跳乐关卡但不难，剧情非常谜语人
222263827,76561198015469960,515,66,25.9,25.9,True,0,0,0.5,0,False,False,False,english,2026-04-01 16:46:48,2026-04-04 16:56:47,GRIME is a great Soulsvania title that offers both challenging enemy encounters using a parry-based combat system and intense platforming segments . Combat and movement has a slow and deliberate pace due to low stamina regeneration and usage of parry while not mandatory is highly encouraged and satisfying. Character progression follows the Souls-style stat increases but traits gathered from absorbing enemies provide the most meaningful bonuses.  [h3]Likes[/h3] + Atmospheric levels with unique designs. + Parry-based Soulslike combat with challenging bosses and enemies. + Open-ended exploration with all DLCs but has random difficulty spikes. + Substantial NG+ content.  [h3]Dislikes[/h3] - No ability to respec stats. - Sprint losing all momentum on jump and small ledges. - Annoying bug with mouse overwriting controller until restart.
222261180,76561198011002622,1166,33,20.2,12.5,False,1,1,0.505300402641296387,0,True,False,False,english,2026-04-01 16:07:23,2026-04-01 16:07:23,"great music, great graphics, performance improved, you can now do fast travel (thanks to a dlc) but finding the thing that shows you the map is still a PITA, Im having a worse time navigating the map blindly than the supposed hard enemies, I hope the secuel gets those things right from the beginning."
222232729,76561198356504804,73,2,18.8,4.2,True,0,0,0.471014469861984253,0,True,False,False,english,2026-04-01 06:24:19,2026-04-01 06:24:19,GREAT SOWRD
222218912,76561198434340571,128,5,29.8,29.7,True,1,0,0.523809552192687988,0,False,False,False,english,2026-04-01 00:45:55,2026-04-01 00:45:55,What a good game with good lineup of bosses. Amazing setting and soundtrack. I'll definitely try ng+ after I'm done with the sequel.
222207496,76561197967793517,1431,232,22.8,22.8,True,1,0,0.523809552192687988,0,False,False,False,english,2026-03-31 21:06:14,2026-03-31 21:06:14,"Top-tier post-Souls Metroidvania, gives the like of Hollow Knight and Blasphemous a run for their money."
222142397,76561198989250194,161,12,47.0,47.0,True,4,3,0.582798480987548828,0,True,False,False,english,2026-03-31 00:38:03,2026-03-31 00:38:03,imagine blasphemous but you are a rock and everything is rocks
222138414,76561198283007120,0,55,1.5,1.5,False,4,0,0.417007476091384888,1,True,False,False,english,2026-03-30 23:14:27,2026-03-30 23:14:27,How is this game deck verified? It runs terribly and makes your steam deck act like it’s having a nuclear meltdown.   Which doesn’t even make sense because the graphics are not great.
222103939,76561199111603285,159,9,61.6,61.6,True,7,0,0.621916711330413818,0,False,False,False,schinese,2026-03-30 14:16:47,2026-03-30 14:16:47,"气质蛮独特的游戏，在通关两年零四个月后重温，仍然能让我为之着迷。 boss战少而精，我印象比较深的有[spoiler]完形信徒、劣等混合物、最终表演、梦诞恐魔[/spoiler]，还有个人最喜欢的[spoiler]整合点秃鹫[/spoiler]，从交互到演出再到bgm都很完美。 探索体验独特，虽然绕半天找不到地图信标和存档点的时候会坐牢，但胜在不同地图探索差异感明显的同时又能很好地融合为游戏世界观下的一个整体。不过我想点名批评[spoiler]子体温床[/spoiler]这张图，疑似制作组放飞自我的产物，充斥着大量意味不明的单向路，玩家往往只是跳下一块平平无奇的石头台阶，结果您猜怎么着？别想回去了，除非再次从存档点绕一大圈过来。 整体流程有点头重脚轻，前中期好些地图又大又复杂（特别是[spoiler]刻形者宫殿[/spoiler]），后期则一路畅通，但在迷了很多路吃了很多苦之后一头扎进[spoiler]金碧辉煌、民风淳厚的纪念碑城，和boss最终表演来上一场优雅的双人舞，弹两下它的超绝慢刀[/spoiler]，心情确实非常舒畅。  最后，还有24小时就能玩上二代了，期待！希望能逛更多有意思的地图，和更多优秀的boss战斗！！"
222077764,76561197993473791,1921,264,12.2,12.2,True,11,0,0.651159286499023438,0,True,False,False,japanese,2026-03-30 04:43:25,2026-03-30 04:43:25,動画版レビュー↓https://www.youtube.com/watch?v=KP6D7W__P-w Flydigi Direwolf 2コントローラーを使用。 [hr][/hr]  [h1]あらすじ＆ゲーム概要[/h1] ダークで異質な世界観を特徴とし、攻撃を“吸収”して反撃/成長する独自のシステムを採用した、高難易度ソウルヴァニア系作品。  崩壊し歪んだ世界の奥底で、突如として生まれ落ちた石の身体とブラックホールの頭を持つ異形の存在である主人公は、生命とも死体ともつかない者たちが徘徊する世界を進みながら、敵を吸収し、力を奪い、自らを進化させていく。  やがて、主人公はこの奇怪な世界の真実と、自身の存在理由に迫っていくことになるのだった。  このジャンルの作品としてはよくある、明確な物語は語られないタイプのストーリー進行となっており、フレーバーテキストや登場人物たちとの会話から物語を読み解いていく形となる。  特に本作は会話や“意味”の分かりにくいモノが多く登場するが、全体を通して、命の誕生、芸術、創造、破壊を象徴、テーマとした内容となっており、それらを抽象的に表した表現やフレーズだと思って物語を読むと理解しやすいはずだ。  例えば、主人公を始め、多くの登場人物（？）は土の塊のような形状なのだが、形が“整っている”物ほど美しいという価値観があり、さらに破壊からの創造という美学を持ったキャラクターも登場する。 “命”の部分に関してもひねった形で表現され、マップの形状や名称がそちらに関連している。  これらの要素と表現方法の影響もあり、独特な世界観とビジュアルを楽しめる。  実際のプレイではこの独特な表現が為されたマップを探索して装備やアイテムを入手しながら、奇妙で致命的な敵との激しい戦闘をこなし、新たな能力を入手し、探索可能な範囲を広げつつ、攻略を進めてクリアを目指していく形となる。  パリィを中心に“アクション”性を重視したゲームプレイを楽しめる作品となっているので、詳しくは次の項目から解説していこう。   [h1]アクションと戦闘[/h1] 武器を使用した通常攻撃、強攻撃的な側面の強い武器毎の特殊攻撃、回避と移動に使用するダッシュ、そして本作で最も重要かつ最もお世話になるアクションである吸収ことパリィを活用して戦闘をこなしていく事となる。  まず、攻撃に関しては武器毎に振りのモーションが異なり、それぞれ攻撃速度も異なる。 重たい武器程攻撃力が高いが、振りも遅いというお約束のアレだ。  さらに、武器によって特殊技、シンプルな強攻撃であったり、敵にデバフを付与するモノまで、こちらも武器毎に異なった様々な特殊攻撃を行えるものが登場する。  “後半の武器の方が強い”という事もないので、プレイスタイルや好みで武器を使用できる点が同ジャンルとしては良い出来となっている。 参考までに、筆者自身はゲームの後半まで、使いやすい事もあり、最初に入手できる武器をずっと使っていた。  実際の戦闘では武器で攻撃しつつ、敵の攻撃にあわせて吸収、本作のキモであるパリィを行う事になるのだが、実は本作におけるパリィの受け付け時間は他の作品よりも少し長め、優しめの判定になっている。  また、敵をパリィして一定回数撃破する事によって敵の能力、後ほど詳しく解説する特性を入手できるので、練習とファームがてら、こちらをこなしていると自然とパリィを使う事に慣れてくる作りになっている点も上手い。  プレイヤーが意識する事なく、プレイを楽しみつつパリィの“チュートリアル”と“練習”をしている風になる。  パリィを成功させると、ザコ敵であれば、敵のHPの赤い部分がかなり減り、基本的には一撃で倒せる仕様になっている。  ただし、敵のHPには“赤い部分”と“灰色の部分”で区切られているモノがあり、こちらの灰色の部分はパリィで与えられるダメージが少なく、通常攻撃で削った方がダメージを与えやすい。  パリィ一辺倒にならないための工夫だろう。  パリィのみにならない工夫としては他にもあり、物語を進めていくと「プル」、敵を引き寄せる能力が新たに入手でき、敵の特定の行動を妨害できるようになる。  特にボス戦ではパリィかプルを行う、どちらも不可能な攻撃は回避を行うという選択肢が入るため、さらにアクション性が高くなり、この手の作品が好きな方であればかなり楽しめるはずだ。  ちなみに、本作の回避、ダッシュはゲーム開始時点からかなり回避性能と移動性能が高いので、そっち方面でストレスに感じる事はないだろう。  注意点としては、回避のスタミナ消費量が多めなので、ゲーム開始時点ではそちらの管理がかなりシビアになってしまう事ぐらいだ。  序盤はスタミナの回復速度が遅めなので、スタミナの回復速度アップや特定の行動、例えばパリィ成功後にスタミナを一定値回復する特性などを習得しないと、行動がかなり制限されるので注意して欲しい。  これは悪い点というわけでもなく、戦闘のバランスが良く練られているのでシンプルにゲーム性として成立している。 敵、特にボスのパターンはしっかりと練られたモノとなっているので、プレイヤーが敵をよく観察し、対応すればスキを簡単につける。  戦闘をプレイしただけでも伝わってくるような、本作の開発者はアクションゲームがよっぽど好きなのだろう。 くどいようだが、そっち方面が本当に良く練られ、良く出来ている。  ちなみに、ネタバレは避けるが、ゲームクリア後はボスとの再戦や、二周目、いわゆるニューゲーム+からは隠しボスと戦闘を行う事も可能なので、やり込みが好き方は試しにそちらも遊んでみると良いだろう。  戦闘関連の不満点を挙げるならば、メインとなる攻撃以外にサブウェポン的なモノがない事が挙げられる。 例えば、敵の攻撃をパリィし、撃破する事で得られる特性の中にサブウェポン的な能力があっても良かったように感じた。 そもそも、これらの能力の仕組み自体が、特殊ではあるが、本家の「ヴァニア」や「ブラッドステインド」の能力の仕組みから影響を受けたものだと思われるので、そっちの要素も欲しかったところだ。  この手のソウルライク、正確にはソウルヴァニアでは、消費アイテムを使った攻撃も可能なので、あえて抜いたのかもしれないが、そちら方面では少々物足りなく感じた。  余談となるが、本作における「エスト瓶」的な要素は二つあり、初期から使えるブレスと、特殊な敵を一定数撃破する事で得られ、チェックポイントで使用回数が回復するアイテムの二種類となる。  前者、ブレスがメインとなるのだが、特殊な特性を解放しない限りは、こちらは敵をパリィし、撃破する事でのみ使用可能であり、最大まで強化しても最大3回までしかストックできないので、わりと被弾には注意が必要だ。  後者に関しても、探索をかなり行わないと集まらないので、人によってはクリアまで1～2個集まるかどうかとなる。   [h1]探索とプラットフォーマー要素[/h1] 探索要素に関しては初期から隠し通路が多く、またある程度は自由に探索できるようになっているので、そっち方面が好きな方も満足できるはずだ。 探索した先には報酬、武器や防具などのご褒美もちゃんと用意されている。  もちろん、メトロイドヴァニア系作品と言う事で、ボスを撃破する事で得られる「空中ダッシュ」や「ダブルジャンプ」といったこのジャンルでお約束の、特定の能力を所持していないと探索出来ない箇所も登場する。  特殊な能力の一つとしては、別の項目でも述べた「プル」、敵を引き寄せる能力だが、こちらは特定の足場を引き寄せる事も可能であるため、それを活用したプラットフォーム要素やギミックも登場する事が挙げられる。  プラットフォーム要素と言えば、本作はそちら方面でもアクション性が高く、いわゆる「チャレンジルーム」的な場所だけではなく、メインで移動する様々な箇所でも挑戦的で魅力的な足場移動を行う必要がある。  これらの足場移動は理不尽と言う事もなく、戦闘と同じように良く練られている。 本作の主人公の基本的なアクションや動作は流動的で直感的に行えるように調整がされているため、普段からプラットフォーマー系作品に慣れている方であれば難しく感じる事はあまりないはずだ。  ただし、そういったプラットフォーマーを普段プレイしない方は少し注意が必要だろう。 何故かというと、例えば「地上でダッシュして別の足場に移動」「梯子をダッシュ移動」「空中で距離を稼いでからプルで足場を引っ張る」などと、少しジャンルに精通している方が考えるような動き、アクションが必要となるからだ。  要は慣れだ。  探索周りの不満点としては、本作にはファストトラベルが存在するのだが、ゲーム後半、それも“倒す必要の無いボス”を撃破した場合にのみそれを行う能力が入手できる事だ。  本項目冒頭で述べたように、本作は序盤からある程度自由に探索が可能なのだが、ファストトラベルの入手が後半になるため、それができないと戻って探索するのが非常に面倒だ。  特に本作はメトロイドヴァニア系作品のお手本となるような“横に長いマップ”構造を取っているので、余計に戻るのが面倒で仕方がない。  正直、初期から可能か、もしくは序盤のチュートリアルあたりのボス撃破などで入手で良かっただろう。  また、もう一つ気になる事があり、プレイヤーが探索しているマップは初期は“見る事”ができず、自身のいる位置を確認できるのみとなっている。 各エリアに配置された“ビーコン”と呼ばれる紫色のクリスタルをインタラクトする事で初めて探索中のエリアマップが確認できるようになるという妙な仕様となっている。  そのため、無意味に探索がし辛く、この仕様がゲームプレイ面で“面白さ”に繋がっているようには感じられなかった。   [h1]RPG要素[/h1] 本作におけるRPG的な要素は敵を撃破する事で得られる通貨を使用したレベルアップ、正確にはステータスの上昇、武器と防具の装備品、そして他の項目でも述べた、一定回数特定の敵をパリィで撃破する事で得られる特性が存在する。  レベルアップに関しては、敵から得られる通貨を篝火的なチェックポイントで使用して、体力（HPの最大値上昇）、気勢（スタミナの最大値上昇）、強さ、器用さ、共鳴という5つのステータスから任意にプレイヤーが好きなモノを上昇させていく、ソウルライクでよく採用されている“あの仕様”となっている。  後半の三種類のステータスは武器の威力に影響を与え、武器毎にステータス補正があるので、自身のビルドに合わせて上昇させると良いだろう。  武器の仕様に関してはアクションの項目で解説したので省くとして、最大で二つまで同時に装備する事が可能なので、こちらもビルドにあわせて装備する形となる。 ビルドと言えば、重要なのが防具だ。  こちらは特定のステータス、例えば体力や強さに補正がかかり、HPを上昇させたり、武器の威力を上昇させる事も可能だ。 また、防具にはそれぞれセット効果があり、三か所装備する事によって、特定の特性を強化してくれる。  そのため、こちらもプレイスタイルにあわせて選ぶと良いだろう。 ちなみに、装備の外見だけを反映させる事も可能なので、見た目だけ好きなモノに変えられる点がありがたい。  そして本作のキモとなる特性だが、こちらはアクションの項目で解説したように、特定の敵を一定回数パリィで撃破する事でその敵に対応した特性が解放可能となる。 注意点としては、特性が解放可能になるだけで、実際に解放するには強力な敵を撃破する事で、あるいは探索を通して入手できる「ハントポイント」を使う事で始めて特性を解放できる事だ。  特性によっては解放後に更に強化を行う事も可能で、例えば「体力が10％アップ」というモノであれば、そのまま強化で「20％アップ」になるといった具合だ。  得られる数に制限のある「ハントポイント」が必要となるので、よく考えて解放した方が良いが、一応は「モトリーパール」と呼ばれるアイテムを消費する事で振り直す/解放し直すことも可能だ。  ただし、このアイテム自体が貴重なので、やはり慎重に解放すると良いだろう。  本作で重要となるパリィの受け付け時間の延長とスタミナの回復速度アップが個人的にはオススメだ。  RPG要素に関しては特にこれという不満点は無いが、あえて挙げるならば、シンプルにまとまっている事ぐらいだ。 アクション要素を重視した作品であるため、特性以外の要素はわりとシンプルで、RPG要素がメインではないという程度だ。  そちらを求めると少し物足りなく感じられるかもしれない。   [h1][b]----------------------【良い点】----------------------[/b][/h1]  + 戦闘、プラットフォーム共にアクションの完成度が高い  + パリィとプル、回避を絡めた戦闘  + ステージとギミックの作りが上手い   [h1][b]----------------------【悪い点】----------------------[/b][/h1]  - ファストトラベルの入手が後半になる  - エリア到達初期はマップが見えない   [h1][b]-----------------------【総評】----------------------[/b][/h1] パリィを絡めた戦闘、上手く作られた地形とギミックを活用したプラットフォーマー要素、それらアクション要素の作りが非常に上手い。 特にアクション要素を重視したゲームを好む方向けの良作だ。  判定緩めのパリィを軸としつつ、プル、回避を絡めた戦闘は良く練られており、ボスのパターンもしっかりと作り込まれている。 さらにプラットフォーマー要素も流動的で直感的な操作感を活かした挑戦的な足場移動が随所に登場し、戦闘と探索の両面でアクションゲームとしての完成度の高さを感じられる。 独特な世界観とビジュアルも相まって、他のソウルヴァニア系作品にはない個性も持ち合わせている。  一方で、ファストトラベルの入手がゲーム後半になる点や、エリア到達初期はマップが確認できないという仕様は、探索のテンポを損なう場面があり惜しい。 RPG要素もアクション重視の設計ゆえにシンプルにまとまっており、そちらに期待すると物足りなさを感じるかもしれない。  だが、アクション要素の完成度という点では、同ジャンルの中でも頭一つ抜けた仕上がりとなっている。 ファストトラベルやマップ周りの不便さはあるものの、それを補って余りある戦闘とプラットフォーマーの面白さ。  アクション重視のゲームが好きな方であれば、自信を持っておすすめできる一本だ。   [hr][/hr]  プレイ動画をアップしているので、本作が気になった方はこちらを参考までにどうぞ。https://www.youtube.com/watch?v=-9JYfIrm-F0 [quote]他にもアクションやメトロイドヴァニア系作品をSteamキュレーター[url=https://store.steampowered.com/curator/32180122/][u]プラットフォーマーズ[/u][/url]で、ローグライク作品を[url=https://store.steampowered.com/curator/37908283][u]ローグライクゲーマーズ[/u][/url]で紹介しています。 良かったら御覧ください。[/quote]
