review_id,steam_id,num_games_owned,num_reviews,playtime_forever_hrs,playtime_at_review_hrs,recommended,votes_up,votes_funny,weighted_vote_score,comment_count,steam_purchase,received_for_free,written_during_early_access,language,date_created,date_updated,review_text
161752146,76561198102818170,374,44,29.4,17.0,True,0,0,0.5,0,True,False,False,koreana,2024-03-29 20:06:12,2024-03-29 20:06:12,"메트로배니아를 기대하고 이 게임을 산다면 분명 후회하게 될 것 스토리는 완전 선형적인 진행인데 중간중간 전맵으로 돌아가서 아이템을 먹으러 가는 게 이 게임의 메트로배니아 요소의 전부다 하지만 액션은 격투게임처럼 콤보를 넣을 수 있고 타격감이 매우 훌륭하다 정밀 플래포머 요소가 꽤 강한데, 스토리 진행하는데에는 높은 실력이 필요없지만 도전과제하기 위해 아이템을 수집하려고 하면 조금 어려울 수 있는 난이도를 가지고 있다 메트로배니아로서는 별로지만 플래포머랑 액션 게임으로서는 높은 완성도를 가지고 있어서 높은 평가를 주고 싶다"
161346231,76561198136046683,0,129,4.7,4.7,True,0,0,0.5,0,False,False,False,english,2024-03-24 12:18:06,2024-03-24 12:18:06,"Guacamelee is a charming metroidvania style brawler that focuses on combos, throws and aerial combat.  I say metroidvania-style, since while you do gain new abilities that let you access new places in old areas, the main path is signposted for you and exploration is not really incentivized unless you want to gather all the power-ups and secrets.  The combat system is great - responsive and impactful. The moves are also incorporated into the platforming challenges. Only problem is that Guacamelee is rather easy on normal difficulty.  On the whole I recommend this game!"
161273865,76561198413704849,0,7,10.1,10.1,True,0,0,0.5,0,False,False,False,spanish,2024-03-23 16:51:06,2024-03-23 16:51:06,Buen juego
161250386,76561198196210839,0,9,22.9,17.7,True,0,0,0.5,0,False,False,False,italian,2024-03-23 12:14:39,2024-03-23 12:14:39,"Ottimo metroidvania, con simpatici dialoghi e numerosissime citazioni a saghe videoludiche che hanno fatto la storia di questo medium. L'ultima parte (quella che si avvicina al boss finale) risulta leggermente ripetitiva e in alcuni punti tediosa ma ciò non influisce troppo sulla bontà complessiva del titolo. Che dire, non vedo l'ora di recuperare il secondo capitolo!"
161001325,76561198053306836,1539,208,13.7,13.7,True,3,0,0.567147612571716309,0,False,False,False,english,2024-03-20 15:42:11,2025-01-24 03:55:55,"Good game! Recommended for any Metroidvania/Platformer fan.   Only personal complaint is that the controls don't feel as snappy as some of the newer platformers, but it's by design. Still strongly recommend it."
160942069,76561198371375648,82,8,19.7,9.1,True,0,0,0.5,0,False,False,False,english,2024-03-19 20:19:14,2024-03-19 20:19:14,learning curve
160821436,76561198390200889,0,14,17.9,13.5,True,0,0,0.5,0,True,False,False,latam,2024-03-18 04:35:23,2024-03-18 04:35:23,"Al igual que el primero, una joyita, mejorando la jugabilidad con otra habilidad y añadiendo mas zonas para explorar y pasartela bien en lo que te dura el juego"
160818332,76561199168346817,108,8,27.9,27.9,True,0,0,0.5,0,True,False,False,latam,2024-03-18 03:21:01,2024-03-18 03:21:01,"GGex, desde niño que me gustaba el juego y extrañé ese sentimiento satisfactorio al terminarlo. --100% 23/02/24"
160805439,76561198002606504,879,177,3.8,1.8,True,0,0,0.5,0,True,False,False,english,2024-03-17 22:59:35,2024-03-17 22:59:35,"Awesome game, characters are super tongue in  cheek, making them endearing!  Love this game, would recommend."
160707124,76561198908823948,120,61,9.7,9.7,True,0,0,0.5,0,False,True,False,brazilian,2024-03-16 22:13:04,2024-03-16 22:13:04,"Gameplay engajante e muito divertida. Senti um pouco de dificuldade artificial perto do final, mas não conseguia parar de jogar. Recomendo muito. [h1]10/10[/h1]"
160604613,76561198092412913,539,68,15.3,6.7,True,0,0,0.5,0,True,False,False,italian,2024-03-15 18:38:08,2024-03-15 18:38:08,
160354640,76561198818760321,172,18,7.4,7.4,True,0,0,0.5,0,False,False,False,russian,2024-03-11 22:24:00,2026-02-14 08:08:02,Самая первая пройденная мной метроидвания на пк. Как для ознакомления с жанром наверное неплохо.
160301475,76561198275469876,667,329,17.4,17.4,True,2,0,0.545454561710357666,0,False,True,False,latam,2024-03-11 00:41:03,2024-03-11 00:41:03,"Espectacular plataformas 2D con un combate brutal. Tiene cooperativo hasta para 4 personas. La ambientación mexicana está muy bien lograda, mezclando lo mejor de la cultura. Desde el día de los muertos hasta la música, todo está hecho con cariño. La historia no es la gran cosa pero el humor en ciertas zonas le da el toque. Combina diferentes mecánicas para que no se sienta repetitivo en ningún momento, teniendo que jugar con todas y cada una de ellas. El diseño de niveles está muy bien pensado. La pasé muy bien jugándolo. Lo recomiendo."
160112916,76561198032541079,414,23,33.2,33.2,True,0,0,0.5,0,True,False,False,latam,2024-03-08 16:11:34,2024-03-08 16:11:34,"Guacamelee! combina magistralmente los estilos de plataformas, metroidvania y beat 'em up. Todo bajo una cuidada y hermosa ambientación, basada en la cultura mexicana, que como buen ciudadano hispano he apreciado enormemente. A todo esto le suma humor del bueno y varias referencias a otros juegos clásicos, que los más veteranos detectaremos enseguida.  El juego en sí tiene una duración media y es bastante lineal sumado a una historia trivial que solo es una excusa. Su dificultad va de menor a mayor y presenta algunos retos complicados que en varias ocasiones nos obligará a repetirlos una y otra vez. Por suerte no llegan a ser frustrantes, ya que gracias a la delicia de sus controles, con un poco de práctica, tarde o temprano los superaremos.  Solamente le achaco que como fan de los metroidvania le faltó mucha más profundidad, pero definitivamente lo recomiendo para todo aquel que disfrute de los tres géneros mencionados al comienzo. Una grata sorpresa que bien vale la pena ser vivida."
160038150,76561197974443732,87,61,30.4,12.9,True,0,0,0.5,0,False,False,False,english,2024-03-07 14:10:04,2024-03-07 14:10:04,¡Muy caliente!
159991534,76561197993946302,3679,69,18.1,18.1,True,0,0,0.5,0,False,False,False,italian,2024-03-06 20:11:43,2024-03-06 20:11:43,"Inizio subito con il dire che Guacamelee! è un signor metroidvania. A me è piaciuto praticamente in ogni suo aspetto. Bella grafica essenziale, belle musiche messicane, bel gameplay con combattimenti divertenti, belle le abilità che si prenderanno progredendo nel gioco, bello il modo intelligente in cui bisogna sfruttare queste abilità per progredire o ancora di più per trovare i segreti, bei personaggi, bei boss. Ho apprezzato anche la presenza delle sfide nell'inferno che costringono il giocatore ad usare o non usare specifiche abilità nei combattimenti o sfruttare le abilità al meglio per finire un percorso in un certo tempo prestabilito. È un gioco fatto con cura e lo consiglio senza riserve a chiunque sia appassionato di metroidvania o semlicemente platform 2D. Il gioco ha solo un neo: l'esistenza di Guacamelee! gold edition. La gold edition è semplicemente lo stesso gioco con piccole differenze, un boss in meno e un paio di mappe in meno. Trovo perfettamente legittimo che dopo aver fatto uscire la gold edition, gli sviluppatori abbiano deciso di arricchire il gioco facendo uscire una versione più completa che è questa, la super turbo championship edition (STCE), ma che senso ha venderle entrambe? Ignari giocatori potrebbero comprarle entrambe credendo che siano giochi diversi, invece sono ESATTAMENTE lo stesso gioco (a parte quelle differenze citate poco sopra). Una cosa più onesta sarebbe stata vendere la STCE e includere anche la gold edition, in modo da permettere a chi vuole, di provare la versione originale, così come hanno fatto gli sviluppatori di Ori and the Blind Forest. Invece al momento sono in vendita entrambe e allo stesso prezzo."
159911703,76561198016405563,225,5,5.5,5.5,True,0,0,0.5,0,False,False,False,polish,2024-03-05 15:54:55,2024-03-05 15:54:55,Cool beat 'em up platformer. Takes around 5h on Normal difficulty with no hurry
159718496,76561199274133641,447,44,6.4,6.4,True,0,0,0.5,0,True,False,False,brazilian,2024-03-02 21:20:16,2024-03-02 21:20:16,Da pra virar uma galinha
159709597,76561199517935282,1681,146,10.0,10.0,True,0,0,0.5,0,True,False,False,english,2024-03-02 19:04:27,2024-03-02 19:04:27,"Guacamelee! Super Turbo Championship Edition is a great Mexican inspired Metroidvania with great beat 'em up style combat, well made level design and platforming, amazing art, and a really good soundtrack to boot. You play as Juan who must don the legendary luchador mask to save El Presidente's Daughter from the evil Calaca. The story has plenty tongue in-cheek humour and there is plenty of Easter eggs to other games found throughout the adventure. Took me about 10 hours to get through and just found it to be a great time!"
159643903,76561198104177230,0,63,25.5,23.5,False,0,0,0.5,0,False,False,False,german,2024-03-01 23:29:01,2024-03-01 23:41:42,"An sich ist das eigentlich ein cooles Spiel mit einer eigenen Art von Humor und einer gewissen Prise Magical Boy Vibe. Mit voranschreitenden Spiel schaltet man weitere Kräfte/Kampffähigkeiten frei und muss verschiedene Bosse der Totenwelt bekämpfen. Die Tatsache, dass man zwischendurch als Hühnchen durch die Kampfgeschichte spazieren muss, bringt ihren eigenen Charme.  Mein Daumen runter liegt jedoch darin begründet, dass es sehr viele Stellen im Spiel gibt, die einfach unnötig schwer/unfair gemacht wurden. So muss man sich an vielen Stellen/Plattformen wortwörtlich milimeterweit durchwuseln, andernfalls schmiert der Charakter direkt ab. Im Kampf kann es vorkommen, dass plötzlich einem sämtliche Gegner auf dem Schoß sitzen, sodass man weder die eigene Spielfigur sieht noch sich irgendwie freikämpfen kann. Oder man trägt Schaden von einer gut entfernten Explosion, die einen trotzdem so trifft als stände man direkt daneben.  Die Bosskämpfe sind machbar, aber an einigen Stellen genau so frustrierend. Insbesondere dann, wenn die Spielfigur plötzlich beschließt sich nicht mehr an der Wand festzuhalten und somit mit voller Wucht eine Strahlenattacke abbekommt. Zwischendurch dauert es aber auch etwas zu lange, bis die Spielfigur wieder aufstehen kann (ohne direkt danach wieder eine geballert zu bekommen, sodass sie wieder komplett flach liegt).  Es gibt in einem Gebiet Bonusherausforderungen, in denen man verschiedene Aufgaben Bewältigen muss. Diese bestehen entweder aus Kämpfen (Besiehe so viele Gegner wie möglich in kürzester Zeit / ohne Spezialattacken / ohne zu Werfen / ohne die Kombo zu unterbrechen usw.) oder schnell von A nach B kommen. Ich habe mich an 6 von bisher 8 ""freigeschalteten"" (der Zugang zu weiteren war durch einen mir noch fehlende Spezialattacken-Block blockiert). 2 finde ich (für mich) nicht machbar, da sie Milimeterarbeit beinhalten und ich irgendwann darauf keinen Bock mehr hatte.  Hätte man das Spiel im Verlauf herausfordernder machen wollen, so hätte man entweder Schwierigkeitsstufen einbauen oder erst nach und nach steigern sollen - aber nicht immer wieder zwischendurch Stellen einbauen, die Frustration gepaart mit Aggressionen hervorrufen. Das nimmt mir dann doch ein wenig die Spiellust, weswegen ich es zum Zeitpunkt dieser Rezension nicht abgeschlossen habe.  Ich werde das Spiel vielleicht zu einem anderen Zeitpunkt beenden und die Rezension eventuell (minimal) anpassen. Wäre eigentlich ein Daumen nach oben gewesen, wenn meine Frustrationsgrenze nicht weit überschritten wäre   [h3] Anmerkung [/h3] Je nach Controller könnte die Tastenbelegung ein wenig anders sein. Ich hatte einen von der Marke VOYEE, welcher mit der Switch kompatibel ist, da waren X = Y; Y = X; A = B und B = A. Die anderen Tasten waren die wie im Spiel vorgesehen. Allerdings erkannte das Spiel den Controller auch nur, wenn er per USB-Kabel angeschlossen war. Per Bluetooth war der unsichtbar (obwohl mein Laptop mit ihm gekoppelt war)."
159530023,76561198384734058,351,192,20.7,20.7,True,0,0,0.5,0,False,False,False,polish,2024-02-29 11:06:19,2024-02-29 11:06:19,"Skakanie i Zabijanie wrogów. Ciekawa i nawet trudna platformówka Zalecam granie na padzie a nie klawiaturze i myszce Grałem sam i nie odczułem jakiegoś wybrakowania zawartości   Trudność gry (według mnie) polega na skakaniu bo dostępnych ruchów jest dużo a do celowania nimi jest tylko jedna gałka pada (oczywiście do aktywowania ruchów służą wszystkie przyciski na padzie ale chodzi mi wyłącznie o sterowanie ich kierunkiem) połowa przycisków ma przypisane po kilka ruchów zależnie od kierunku  a więc nie trudno o przesunięcie gałki jeden milimetr za daleko by wykonać inny ruch niż byśmy chcieli, i zdarza sie to często a w późniejszej fazie gry jeden zły ruch często prowadzi do ponownego przechodzenia etapu   Backtracking'u jest dość dużo (na szczęście są teleporty), co chwile dostajemy nową umiejętność która pozwala nam wykonać ruch dzięki któremu możemy dostać sie w nowe miejsce na wcześniejszym poziomie, w większości przypadków te miejsca to po prostu punkty zwiększające pasek życia, energi i czasem superumiejętnośći lub pieniądze potrzebne do ulepszeń które nie są zbyt rozbudowane, ot więcej życia czy szybciej regenerująca sie energia   Pomimo tych minusów gra ma dużo do zaoferowania : Humorystyczną i klimatyczną fabułę opierającą się na kulturze meksykańskiej  Różnorodny zestaw ruchów i umiejętności  Zróżnicowani przeciwnicy i ciekawie zaprojektowane poziomy  Poboczne questy Kilka bossów  Troche zawartości poza główną ścieżką"
159494014,76561198036150466,308,80,16.2,16.2,True,0,0,0.5,0,False,True,False,russian,2024-02-28 20:53:32,2024-02-28 20:53:32,"Даже не знаю, когда и где получил игру, но было это много лет назад. Был уверен, что это какой-то пиксельный трэш не стоящий внимания. Но как же я ошибался!!! Это отличная метроидвания, с юмором, с отличной музыкой, без огромных заморочек (хотя на 100% ачивок сделать очень сложно). Рекомендую всем любителям данного жанра. А я пошел смотреть, что там нагородили во второй части ;)"
159367414,76561198290107231,257,15,16.7,16.7,True,0,0,0.5,0,True,False,False,english,2024-02-27 03:38:00,2024-02-27 03:38:00,10/10
159290123,76561199140442109,199,42,15.5,15.5,True,0,0,0.5,0,False,False,False,english,2024-02-26 00:20:41,2024-02-26 00:20:41,rayman legends but instead of rayman it is el primo🗿
159284040,76561198362975566,166,4,11.7,8.3,True,0,0,0.5,0,False,False,False,italian,2024-02-25 22:26:13,2024-02-25 22:26:13,"Metroidvania molto chill che fa del suo punto forte la coop locale e l'ironia, con tante citazioni a videogiochi e meme. Consigliato."
159166367,76561198116847505,0,22,7.0,5.8,True,0,0,0.476190477609634399,0,False,False,False,english,2024-02-24 17:02:26,2024-02-24 17:02:26,
159055137,76561198332053998,581,25,67.2,67.2,True,1,0,0.523809552192687988,0,False,False,False,italian,2024-02-23 13:12:32,2024-02-23 13:12:32,"Splendido metroidvania. Vero metroidvania (non sono uno di quelli che chiama così ogni gioco con prospettiva laterale), con raccolta di poteri, backtracking proficuo e level design complesso, intricato e ben curato."
158983660,76561199466433907,167,10,20.5,7.7,True,0,0,0.5,0,True,False,False,latam,2024-02-22 16:25:09,2024-02-22 16:25:09,"Muy buen juego, bastante entretenido aunque con un inicio lento que es compensado con todo el resto del juego que es maravilloso No lo intenten platinar, las pruebas del infierno en oro son una agonía"
158395903,76561198094479567,0,83,27.4,27.4,True,0,0,0.5,0,False,False,False,english,2024-02-15 19:33:59,2024-02-15 19:33:59,"Guacamelee is a delightful (albeit slightly dated) Metroidvania game that offers a user-friendly learning curve and an effortless integration of combat and parkour mechanics. I first played it on my PS4 in 2015, but was recently encouraged to revisit it after completing the Ori series, which also serves as an excellent introduction to the genre.  While the narrative in Guacamelee is minimal, it successfully intertwines with the gameplay and environments. The main characters are vibrant and fulfill their roles effectively, without overstaying their welcome. However, I cannot say the same for the villains (bar Calaca), as they provide little substance beyond comic relief, particularly in their disappointingly easy boss battles.  The true standout feature of the game is the aforementioned combat and navigation mechanics. The map is filled with various colored blocks, each corresponding to a specific move. As you progress through the game, you acquire these moves in classic Metroidvania fashion. By utilizing these moves, combat can range from straightforward to intricate. Although the variety of enemies is somewhat lacking, the game strategically places them throughout, constantly keeping the player engaged.  The parkour elements in Guacamelee deserve special mention, particularly during moments such as the Tule Tree, where movement and puzzle-solving are seamlessly combined. However, there are also instances where the movement can be frustrating, such as in the orb challenges. These segments push the game's mechanics to their limits, and the player may face consequences for any missteps.  Overall, Guacamelee provides a highly enjoyable, compact gaming experience that can be acquired for a super cheap discounted price. Prior to playing, I would recommend adjusting your sense of humor to align with the style of the 2010s, as the game frequently utilizes classic phrases like ""derp"" and ""trollololol""."
158374087,76561198323682692,544,132,15.2,14.1,True,2,0,0.526348769664764404,0,False,True,False,schinese,2024-02-15 13:31:08,2024-02-15 13:31:08,忘了啥时候免费领的了，以前看到过“墨西哥英雄大混战”这个逆天搞笑的中文译名下过盗版但是没通关，现在真结局通关了。应该算是早期独立游戏里相当精良的一款了。易上手难精通的战斗系统、巧妙地将战斗招式与能力锁设计相结合、独特的拼贴风格画面、王道又搞笑的剧情（当然达成完美的真结局还是挺麻烦）、浓厚的墨西哥风情还有超多游戏的彩蛋（例如《城堡破坏者》、《风之旅人》、《冥界狂想曲》、《VVVVVV》等）都是值得游玩的地方。    生者和亡者世界的切换也是本作的一大特色，围绕这个系统做出了非常不错的关卡设计（[spoiler] 说真的，虽然踩一捧一不好，但我真觉得比sabotage做的《信使》要好玩多了。。。 [/spoiler]）跳跳乐挺多但是秒杀地形很少，掉下悬崖会光速给你传送回来，除了几个地方以及真结局所需道具的部分还是挺高血压的以外算是友好了。服装系统也有助于逃课，没有小鸡套和恶魔套我大概是看不到真结局的（doge）    传送点较少以及最终boss是纯纯数值+机制怪，不满意。
158293712,76561197991825366,0,61,7.7,5.2,True,0,0,0.5,0,True,False,False,english,2024-02-14 10:33:17,2024-02-14 10:33:17,"This game screams Mexican culture and vibrancy ranging from the music and colours to the aesthetic. Awesome combat mechanics with intricate fun combos combined with metroidvania exploration and progression. The platforming and jumping is like no other game I have played, imagine traversing realms mid jump in order to get to your destination, a spike wall that can now be stood on or a platform appearing beneath your feet. Really well made and a lot of fun."
158278475,76561198025202372,487,2,21.6,21.6,True,0,0,0.5,0,False,False,False,english,2024-02-14 04:28:33,2024-02-14 04:28:33,"Difficulty scales very well in this game. I had moments of extreme frustration towards the endgame, but that feeling of exhilaration after beating a boss made every moment worth it."
158231442,76561198119681249,278,34,17.6,3.2,True,0,0,0.5,0,True,False,False,swedish,2024-02-13 14:16:50,2024-02-13 14:16:50,Better then the original release.
158196280,76561198129106156,449,3,9.5,5.7,True,0,0,0.5,0,False,False,False,brazilian,2024-02-13 01:03:26,2024-02-13 01:03:26,ToP dEmAiS
158073110,76561198151715319,1142,463,6.2,6.2,True,2,0,0.545454561710357666,0,False,False,False,turkish,2024-02-11 12:10:01,2024-02-11 12:10:01,"Zamanında oynayıp bitirdiğim hızlı, keyifli ve sıkmayan hikayesiyle düzgün bir metroidvania. Eğlenmiştim. Daha da ne beklenebilir ki...  Puan tablom ise;  50 < Oynanmaya değmez 51 - 59 = Çok Kötü 60 - 69 = Kötü 70 - 79 = İdare Eder 80 - 89 = İyi 90 - 95 = Çok iyi 96 - 99 = Mükemmel 100 = Yok öyle bir oyun.  PUAN = 77"
158039827,76561198867174823,1064,151,16.6,16.2,True,0,0,0.5,0,False,True,False,brazilian,2024-02-11 00:32:52,2024-02-11 00:32:52,Metroidvania de um luchador mexicano
158020387,76561197970507680,250,50,84.0,27.6,True,0,0,0.5,0,False,False,False,english,2024-02-10 19:00:32,2024-02-10 19:00:32,
157904565,76561199133194214,0,17,27.6,6.2,True,0,0,0.5,0,False,False,False,english,2024-02-09 06:02:48,2024-03-14 22:21:31,Good game
157836917,76561198394338777,263,54,68.7,68.7,True,0,0,0.5,0,False,True,False,italian,2024-02-08 09:40:52,2024-02-08 09:48:53,"Got the game for free, 100% completed it and bought the second one. It is an awesome platformer. The music and the atmosphere are awesome  A successor to Metroid"
157672937,76561198051906324,80,2,48.0,14.9,True,0,0,0.5,0,True,False,False,english,2024-02-05 20:56:53,2024-02-05 20:56:53,awsome
157650579,76561199229195904,0,14,6.0,6.0,True,0,0,0.47826087474822998,0,True,False,False,finnish,2024-02-05 14:08:23,2024-02-05 14:08:23,"I will leave the cat here, so that everybody who passes by can pet it and give it a thumbs up and awards 　　　 　　／＞　　フ 　　　 　　| 　_　 _ l 　 　　 　／` ミ＿xノ 　　 　 /　　　 　 | 　　　 /　 ヽ　　 ﾉ 　 　 │　　|　|　| 　／￣|　　 |　|　| 　| (￣ヽ＿_ヽ_)__) 　＼二つ"
157600308,76561199553962809,0,8,127.3,112.3,True,0,0,0.5,0,True,False,False,english,2024-02-04 19:28:11,2024-02-04 19:28:11,it is fun
157539470,76561198041574102,0,35,104.5,104.3,True,0,0,0.5,0,False,False,False,brazilian,2024-02-04 01:55:04,2024-02-04 01:55:04,Divertido para jogar em dois. Algumas fases na frente são muito difíceis de passar.
157407003,76561198177586287,127,50,18.9,18.9,True,0,0,0.5,0,True,False,False,english,2024-02-02 13:09:33,2024-02-02 13:09:33,"I have played Guacalmelee before on my PS Vita (base game + DLCs which effectively amount to the Guacamelee! Gold Edition). The handheld provided a great experience with a good control scheme and good colors on the OLED.  And now I have picked up both Guacamelee! Gold Edition and Guacamelee! Super Turbo Championship Edition on Steam.  Since the 2 games are related I will provide the same review for both. [b]TLDR:[/b] If you are new to the Guacamelee franchise, it is a very fun and thoughtfully designed game and I highly recommend it. I would recommend the STCE over the Gold Edition for new players because it has more levels.  [b]Pros:[/b] - Good music - Thoughtful level design and teaching is done incrementally on the job, resulting in a good difficulty curve. - Colorful theme. - I am proud to say I 101% this game without referring any online guides (especially for hidden collectibles). - Hard mode provides a good challenge and makes the bosses much more challenging. - Practical quick travel system that does not take away from exploration.  [b]Comments on STCE[/b] Having effectively 100% completed the Gold Edition twice (once on the PS Vita and once again on Steam), I took good note of the changes in STCE. Of course the main addition in STCE is the expanded map and levels but there are mechanic changes, etc. as well. - STCE tutorial could have explained that Y (on a controller) also allows clinging to the wall - Color saturation was changed, I didn't appreciate it on some levels. - Using the bright purple color scheme provides a way to tell players that the attack is not dodgable but takes some of the immersion in some cases, eg: (spoiler) [spoiler] Lava attacks in the final fight should be orange. [/spoiler] - [spoiler] Requires confirmation but I think you can unlock the happy ending with one less orb, or at least the cut-scenes will be unlocked in the menu? [/spoiler] - Mixed feelings about combat balance since we have more health and stamina upgrades compared to the GE. This especially applies to getting gold medals in the Inferno levels, especially since we now have Intensio."
157318824,76561198037742939,0,32,8.1,8.1,True,0,0,0.5,0,False,True,False,english,2024-02-01 09:39:49,2024-02-01 09:39:49,"Combat and platforming are solid and fun, but damn did the writing age badly."
157157523,76561198117211565,0,12,21.7,21.7,True,0,0,0.5,0,False,False,False,german,2024-01-30 01:41:30,2024-01-30 01:41:30,Nice Metroidvania
157139488,76561198340428400,0,59,11.5,11.1,True,0,0,0.5,0,True,False,False,brazilian,2024-01-29 19:22:19,2024-01-29 19:22:19,excelente
