review_id,steam_id,num_games_owned,num_reviews,playtime_forever_hrs,playtime_at_review_hrs,recommended,votes_up,votes_funny,weighted_vote_score,comment_count,steam_purchase,received_for_free,written_during_early_access,language,date_created,date_updated,review_text
205057296,76561198031392756,202,8,7.5,7.5,True,0,0,0.5,0,True,False,False,koreana,2025-09-23 21:07:20,2025-09-23 21:07:20,"진라면 순한맛 같은 메트로베니아 가벼운 분위기와 액션의 조합이 꽤 괜찮은 맛을 보여줌. 해당장르 게임 입문으로 추천해도 괜찮음."
204942394,76561198036316467,0,19,5.0,4.4,False,0,0,0.408921927213668823,0,False,False,False,english,2025-09-22 12:07:34,2025-09-22 12:07:34,"Should really be called Stunlock!: The Game. Odd mash-up of precision platformer and combo brawler... Kinda like if Super Meatboy and Streets Of Rage got messy drunk and had a baby. Combat is a total mess, controls feel like you are wearing oven mitts and the controller is covered in grease and half the buttons are stuck. Good luck if you are remotely colour blind - this game hates you. Could only be called a 'metroidvania' by someone that has never played a metroidvania as exploration is practically zero and the game is linear as can be. Delightful art style and every colourful, and genuinely quite funny writing."
204920701,76561197999548800,0,42,19.4,11.4,True,0,0,0.5,0,True,False,False,german,2025-09-22 02:50:09,2025-09-22 02:50:09,"Insgesamt ein nettes Metroidvania-Game, manche Passagen sind allerdings einfach zu schwierig. 100% sind kaum erreichbar."
204920621,76561199547567579,0,2,7.7,4.1,True,0,0,0.5,0,True,False,False,spanish,2025-09-22 02:48:19,2025-09-22 02:48:19,"Me gusto el diseño basado en la cultura mexicana, lo recomiendo si decides conocer mas de mi hermosa cultura mexicana. Excelente, me encanto y espero poder comprar el guacamelee 2."
204913732,76561198328478795,138,14,74.2,74.2,True,0,0,0.476190477609634399,0,True,False,False,english,2025-09-22 00:20:24,2025-09-22 00:20:24,"Such a great metroidvania! The combo system is satisfying, the controls are tight, and the platforming is challenging, but just the right amount. A second player can also jump in at anytime."
204900077,76561198447753809,73,71,2.3,2.3,True,0,0,0.5,0,False,False,False,english,2025-09-21 20:11:09,2025-09-21 20:11:09,fun
204835273,76561198283970021,261,171,41.5,38.3,True,0,0,0.5,0,True,False,False,spanish,2025-09-21 03:13:38,2025-09-21 03:13:38,"Es un juego genial. La historia en si misma es corta, y el mapa pequeño, pero si te pones a explorar puedes estar ahí un buen rato intentando el parkour. Da gusto volver a zonas viejas para limpiarlas y el combate es fácil de aprender pero muy disfrutón. Un buen primer metroidvania"
204663172,76561198212717035,93,32,6.8,6.8,True,0,0,0.5,0,True,False,False,english,2025-09-19 01:38:33,2025-09-19 01:38:33,Consider me a happy customer with this game. Would play again.
204642844,76561198018294580,1723,53,9.8,9.8,True,1,0,0.530201315879821777,0,False,False,False,spanish,2025-09-18 19:36:33,2025-09-18 19:36:33,"La historia de Juan Aguacate!! Un metroidvania TOP, muy disfrutable de principio a fin gracias a sus mecánicas, su plataformeo perfecto, la historia y el sentido del humor y referencias.  Le terminé hace unos años y ahora estoy con la segunda parte así que aprovecho para recomendarle!"
204610527,76561198017413317,0,91,1.4,1.4,False,2,0,0.501533746719360352,0,True,False,False,french,2025-09-18 10:50:30,2025-09-18 10:50:30,"Si c'est un metroïdvania que vous cherchez : passez votre chemin. - L'aspect ""nouveau pouvoir débloque des chemins"" est ridicule ( 4 pouvoirs utilisables à des endroits flagrants ( des gros blocs de couleur ) - les combats sont ridiculements faciles et se résument souvent a des arènes de quelques vagues. - Le platforming, en revanche, est infâme.  Le seul point positif est la D.A et le folklore des Luchadors, mais ça ne suffit pas à en faire un bon jeu.  Grosse deception"
204494727,76561199269002466,33,17,32.2,32.2,True,0,0,0.5,0,True,False,False,spanish,2025-09-16 18:17:35,2025-09-16 18:17:35,"Amo este juego lo complete todo y merece mucho la pena para los que aman la cultura mexicana y otras y tambien jugabilidad, musica, referencias, memes...etc."
204450564,76561198210161388,0,134,3.7,3.7,True,0,0,0.5,0,True,False,False,english,2025-09-16 02:39:33,2025-09-16 02:39:33,"You play as Juan Aguacate, a humble agave farmer turned supernatural luchador after donning a magical mask. Your mission? Rescue El Presidente’s daughter from the evil Carlos Calaca, who’s trying to merge the worlds of the living and the dead. Classic villain move. Honestly, Calaca probably just needed a hug and a burrito."
204268106,76561198295364937,0,15,39.7,39.7,True,0,0,0.5,0,False,False,False,latam,2025-09-13 20:33:36,2025-09-13 20:33:36,"Pinche juego todo culero me lo tuve que pasar varias veces para sacarle todos los logros y como que le agarre asco xd, pero aún así lo recomiendo muy cotorro la verdad"
203902035,76561199198952236,0,18,9.5,8.5,True,0,0,0.462633430957794189,0,True,False,False,english,2025-09-08 20:37:12,2025-09-08 20:37:12,hola
203877144,76561198316800721,244,211,10.9,10.9,True,3,0,0.560293138027191162,0,False,False,False,brazilian,2025-09-08 14:07:30,2025-09-08 14:07:30,"Gostei do jogo em geral, das ambientações, dos cenários belíssimos, dessa cultura mexicana do Dia de Los Muertos, que encaram a morte como algo mais positivo e animado, e principalmente a Lucha Livre, que eu acompanhava no passado (tenho até a máscara do Rey Mysterio). O jogo é mais puxado para ser engraçadinho, colocando uma dose de humor ali ou aqui, na medida certa, mas o que para mim encheu o saco foi aprender muita mecânica, e ser um jogo curto. Um ponto bem positivo é a dificuldade em algumas partes, no qual precisava apertar botões específicos para não errar, foi aí que xingava esse jogo (tenho pulga atrás da orelha que os controles não são tão responsivos). Os chefs tem sua dificuldade elevada, princialmente o último, mas é só decorar os padrões, depois de muitas mortes, ""e aquele bicho papão não vai existir mais""."
203865954,76561198151721416,665,258,13.0,13.0,True,0,0,0.442176848649978638,0,True,False,False,english,2025-09-08 10:43:10,2025-09-08 10:43:10,I give it a funny bone out of 10
203817601,76561198019244999,0,25,4.0,2.8,True,0,0,0.5,0,True,False,False,english,2025-09-07 18:14:36,2025-09-07 18:14:36,Muy bueno!
203806313,76561198869562881,0,7,13.5,8.9,True,1,1,0.52173912525177002,0,True,False,False,schinese,2025-09-07 15:57:38,2025-09-07 15:57:38,接近完美的银河城
203785902,76561198306486282,1062,88,7.1,5.0,True,5,1,0.538461565971374512,0,False,True,False,russian,2025-09-07 11:51:22,2025-09-07 11:51:22,лучше любого ♥♥♥♥♥♥♥ силксонга
203677472,76561197979953970,688,652,5.2,3.9,True,1,0,0.523809552192687988,0,False,True,False,english,2025-09-06 08:36:33,2025-09-06 08:38:01,"Im usually not that into metroidvanias, but im really really enjoying this one. Usually these games are hard as nails and once you get all abilities you are faced with impossible challenges, but here the difficulty curve is fair and smooth. Art style and music are great, but im not really a fan of the kind of meta humour it has.  This STCE is the more complete version of the game."
203634108,76561199487293533,0,3,33.7,33.7,True,0,0,0.476190477609634399,0,True,False,False,english,2025-09-05 19:59:40,2025-09-05 19:59:40,"Love these types of games, platformers, rpg, roguelike essentially metrovania. really enjoyed it. looking forward to the next title. its a good game."
203484542,76561199571250421,0,5,11.3,11.3,True,0,0,0.5,0,True,False,False,german,2025-09-04 05:28:19,2025-09-04 05:28:19,"Gilt bereits als eine Art Klassiker und ist besonders Anfängern zu empfehlen, die mal ins Metroidvania-Genre reinschnuppern wollen. Coole Wrestling-Moves, einfache Steuerung und nette humoristische Story. Die kantigen Animationen treffen zwar nicht ganz meinen Geschmack und die Spelzeit hätte gerne etwas länger sein dürfen, aber ansonsten ein würdiger Genre-Vertreter. 8 von 10 Luchador-Masken."
203409640,76561198341816113,0,20,12.2,12.2,True,3,0,0.564474821090698242,0,True,False,False,english,2025-09-02 21:04:42,2025-09-02 21:04:42,locking the good ending behind all collectibles sure is a surefire way to get me to get all collectibles
203356280,76561198163217147,327,30,18.0,18.0,True,1,0,0.523809552192687988,0,True,False,False,spanish,2025-09-01 23:57:45,2025-09-01 23:59:01,"Una buena iniciación a los metroid-vanias.  Habiéndolo jugado en 2025, tras otros juegos del género como Hollow Knight y Blasphemous, me parece un poco difícil e injusto juzgar este. He de decir también que lo he jugado directamente en modo Difícil (desbloqueado con el truco de ""arriba, arriba, abajo, abajo, izquierda, derecha izquierda, derecha, A, W, Espacio""), para que lo tengamos como referencia.  Está muy bien si quieres un juego de este género, pero no quieres echar tantas horas y no quieres una dificultad tan endiablada (en modo normal, porque en difícil hay algunas partes que dan ganas de estampar el mando). Por el precio no puedo decir nada, ya que te lo encuentras en muchas partes a euro y pico, que es un café. La originalidad e innovación hay que juzgarla teniendo en cuenta que es un juego de 2013, y se ve en la variedad de enemigos, que el camino es mucho más directo, la historia bastante poco desarrollada...   Sin embargo, sí que tiene cosas muy originales en algunas mecánicas que vas desbloqueando más tarde.  Le doy el pulgar arriba por el año en que salió, el precio al que te lo puedes encontrar, que puede estar dirigido a cierto público y porque es una experiencia más contenida y, aún así, muy currada. Lo que no puedo hacer es recomendarlo por encima de los ya mencionados Hollow Knight y Blasphemous en cuanto lo que es un producto redondo se refiere."
203152376,76561198391646915,163,109,6.8,6.8,True,0,0,0.5,0,True,False,False,spanish,2025-08-30 02:29:04,2025-08-30 02:29:04,Mechico :D
203090291,76561198079895524,0,105,24.3,24.3,True,0,0,0.5,0,False,False,False,english,2025-08-29 04:29:52,2025-08-29 04:29:52,8/10
202987594,76561198984014153,0,22,6.1,6.1,True,0,0,0.5,0,True,False,False,koreana,2025-08-27 14:58:24,2025-08-27 14:58:37,모난 부분 없이 직관적으로 잘 만든 메트로배니아
202813386,76561198031913299,820,565,11.1,11.1,True,0,0,0.5,0,False,False,False,english,2025-08-24 20:47:25,2025-08-24 20:47:25,"For all wrestling, Mexico, and Mexican wrestling fans"
202706760,76561198324610954,490,41,7.1,4.2,True,0,0,0.5,0,False,False,False,german,2025-08-23 10:29:56,2025-08-23 10:29:56,eeel priiimooo
202585370,76561198273506234,133,43,12.4,12.4,True,0,0,0.5,0,True,False,False,koreana,2025-08-21 13:57:01,2025-08-21 13:57:01,"장점 : 좋은 타격감, 많은 탐험 요소와 기믹들, 속도감 있는 플랫폼 액션, 막힘없는 진행  단점 및 호불호 요소 : 후반가면 청기백기가 되어버리는 전투, 지역간 불편한 숏컷과 빠른이동 시스템, 맵 마커 없음  스토리는 단순하기 짝이 없지만 그 덕에 시종일관 흥겨운 분위기를 해치지도 않으며, 감점 요인으로 작용하지도 않음 편의성은 세이브 포인트를 퍼주는데다 낙사 후 복귀 지점에 대해서도 관대하나, 지역간 이동과 마커는 이미 언급했다시피 미흡함 플랫포밍 난이도는 스토리만 민다면 전반적으로 무난한 난이도이나 챌린지와 진엔딩은 개인적으로 오리보다도 빡셌음 액션은 콤보와 잡기 기술로 좋은 타격감을 주지만 은근히 답답한 조작감과 스킬 후딜로 인해 쾌적하진 않으며, 후반으로 갈수록 적들이 무적 보호막과 차원을 오가는 기믹을 두르고 나오기에 콤보 시스템의 장점은 퇴색되고 빨리 색깔 맞춰 기술로 보호막 부수고 딜찍누하는 식으로 단순해져버림  플레이타임은 짧은 편이니 속도감있고 적당히 도전적인 메트로배니아를 원한다면 좋은 게임"
202409708,76561197961161034,0,4,39.0,9.8,True,2,0,0.545954883098602295,0,True,False,False,english,2025-08-18 19:26:41,2025-08-18 19:26:41,"Couch coop on PC with controllers works great. My wife and I loved Salt+Sacrifice, and Salt+Sanctuary, this feels quite similar and is good fun. Would have liked more variety of monsters, but the combos that you gradually learn are fun to execute."
201931043,76561198281859850,645,75,5.2,5.2,True,0,0,0.5,0,True,False,False,turkish,2025-08-11 19:27:05,2025-08-11 19:27:05,Oyun gayet güzel ancak son kısımlarda ölünce saçma sapan geri kısımlarda başlatması sinir bozucuydu.
201834003,76561198032649576,2810,1069,10.8,10.8,False,1,0,0.420142441987991333,0,False,True,False,english,2025-08-10 10:50:18,2025-08-10 10:50:18,"The story isn't bad, but the ending is dumb. Everything else is ell ♥♥♥♥. The levels that are mostly puzzles require perfection, even the battles. Sometimes cooperation helps, sometimes it hinders. The balance is crap. This is a crappy game, just like its creators."
201796899,76561198141210687,123,18,15.1,15.1,True,0,0,0.5,0,False,True,False,russian,2025-08-09 20:22:30,2025-08-09 20:22:30,"[h3]Плюсы ❤️[/h3] - Симпатичный визуальный стиль - Много отсылок на другие игры - Использование способностей не только в сражениях, но и в платформинге - Локальный кооп - Оптимальная продолжительность - Почти всю игру понятно, куда идти и что делать  [h3]Минусы 💔[/h3] - Иногда музыка играет не в тему - В последней трети игры резко повышается сложность - Обычная концовка не приносит ощущения завершенности произведения (а “правильная” концовка - это слишком задротская) - Секции для платформинга не очень хорошо играются в коопе (зачастую, один их проходит, а второй ожидает)  [h1]Оценка: 3/5[/h1]"
201786678,76561198103472011,1152,311,19.0,7.7,True,0,0,0.5,0,False,False,False,brazilian,2025-08-09 17:22:06,2025-08-09 17:22:06,"o jogo é muito bom, divertido, animado, te da vontade de continuar, só que pela amor, os caras avacalharam demais no ultimo boss, sem lógica aquela dificuldade."
201655712,76561199511138291,0,38,8.5,8.5,True,0,0,0.5,0,True,False,False,english,2025-08-07 19:13:48,2025-08-07 19:13:48,"""gonna cut it off, chop it up, & make some guacamelee"""
201629009,76561198453518541,491,188,25.0,25.0,True,0,0,0.5,0,False,False,False,english,2025-08-07 11:15:42,2025-08-07 11:15:42,The villain has an awesome pet
201376345,76561198078031281,0,5,7.6,6.0,True,0,0,0.5,0,False,False,False,spanish,2025-08-03 17:12:29,2025-08-03 17:12:29,"entretenido , con buen ritmo , humor desenfadado,  con referencias a cultura latina y juegos indie."
201302328,76561198132389502,376,173,25.7,25.7,True,0,0,0.46060606837272644,0,False,False,False,english,2025-08-02 17:51:28,2025-08-02 17:51:28,Metroidvania ที่ปั่นอีกเกม แต่มี Easter Egg ของเกมอื่นเยอะไปนิด สนุกดี แต่ถ้าจะเก็บของทุกอย่างก็ใช้เวลาหน่อย
201065767,76561198842782615,0,604,23.7,23.7,False,0,0,0.5,0,False,True,False,russian,2025-07-30 12:59:36,2025-07-30 12:59:36,"Colorful and stylish, but quickly gets repetitive and boring. Looks better than it plays. 5/10"
200966956,76561197968354551,0,7,20.9,20.9,True,0,0,0.5,0,False,True,False,english,2025-07-29 05:33:24,2025-07-29 05:40:00,Excelent game! is funny how stereotype mexico in the good way and as a Mexican we enjoy view our culture in every chingadera.
200737126,76561198075234803,423,361,14.4,14.4,True,0,0,0.5,0,False,False,False,english,2025-07-26 08:35:12,2025-07-26 08:35:12,8/10
200699633,76561198067785843,271,39,1.7,0.8,False,1,0,0.45769113302230835,0,False,True,False,english,2025-07-25 20:17:01,2025-07-25 20:17:01,Absolute ♥♥♥♥♥♥♥
200676389,76561199076309422,0,18,28.3,19.1,True,0,0,0.5,0,True,False,False,english,2025-07-25 14:40:45,2025-07-25 14:40:45,Absolutely cinema
200545737,76561198090549054,1006,1200,25.1,25.1,True,14,0,0.62791597843170166,1,False,False,False,russian,2025-07-24 13:16:58,2025-07-24 13:16:58,"Хороший платформер-метроидвания с возможностью играть в коопе. Вполне неплохая метроидвания с приятным визуалом и разными комбо ударами, боссами и секретками. Даже без знания языка всё понятно, т.к. сюжет доносят сценками."
200471292,76561198962578664,63,32,1.6,1.6,True,2,2,0.502512574195861816,0,False,True,False,russian,2025-07-23 23:36:01,2025-07-23 23:36:01,Жеска игра про моего любимого персонажа из Brawl Stars
200466584,76561199475152117,100,55,14.4,14.4,True,0,0,0.5,0,False,False,False,latam,2025-07-23 21:51:47,2025-07-23 21:54:52,"Juegazo!! no hay falla, sigue tan bueno cómo hace años que lo jugué <3, un imperdible de los metroidvania 9/10 ... por cierto, no se olviden de activar/suscribirse a los skin en la pestaña de workshop, pueden allar de Kratos, Bayonetta, Lara, Samus, He-man, Chapulin etc. etc."
200230218,76561198394693925,2856,376,35.2,22.9,True,0,0,0.5,0,True,False,False,tchinese,2025-07-20 13:16:19,2025-07-20 13:16:19,it is a good game
200200826,76561198447393873,0,21,42.8,34.5,True,1,0,0.523809552192687988,0,False,False,False,spanish,2025-07-20 02:43:57,2025-07-20 02:43:57,"Si hay algo bueno de los juegos Indie,es que no dependen sus tramas de ""oh pero la historia continuara"" y asi por secuelas,spinoffs,dlc,merch,etc.sino que viven gracias a una sincera comunidad de jugadores que lo aprecian por lo que es,no por otros juegos,eso es Guacamelee,uno de esos juegos con historia simple pero buena,y personajes que,aunque incluso puedan llegar a ser los malos de el cuento,te encariñas con ellos y tienes ese deseo de que talvez,hubiese habido una oportunidad de darles la chance de redimirse y ayudar,es una joya que hasta el dia de hoy,de vez en cuando se le hace referencia en otros juegos mas actuales,y se agradece"
199998355,76561199610973268,36,34,13.0,13.0,True,2,1,0.519841313362121582,0,True,False,False,english,2025-07-17 09:28:45,2026-02-08 20:54:46,"DO YOU LIKE HOLLOW KNIGHT?! DO YOU LIKE DEMONS?! DO YOU LIKE CHICKENS?! DO YOU LIKE DEMON CHICKENS?! THEN THIS IS THE GAME FOR YOU!                                     Now to the real review  This game's similarities with Hollow Knight can't go unnoticed. This game is definitely funnier than Hollow Knight, and has an easier to follow story, and it's easier in general, and it has optional multiplayer. I have bias since this I played this game way before and have much nostalgia, and even so I say this game is only a little worse than Hollow Knight, despite what I've been saying. I truly recommend this game, but I've never played Guacamelee 2 and I never will, in fear of it ruining the experience. Either way, Guacamelee got its sequel before Silksong soooooooooo  Sensational game. Wish I could re-experience for the first time. 8.25/10"
199867842,76561198023148510,0,61,13.5,13.5,True,0,0,0.5,0,False,False,False,italian,2025-07-15 15:59:09,2025-07-15 16:34:05,"Sono un pò perplesso nei riguardi di questo gioco. Se da un lato apprezzo molto lo stile artistico ed il combattimento, dall'altro non posso fare altro che notare delle evidenti storture e sbilanciamenti che inevitabilmente abbassano il livello complessivo di questo metroidvania. Innanzi tutto, come detto, lo stile del gioco è secondo me non solo molto apprezzabile, ma originalissimo. Non sono molti i videogiochi così tanto ispirati alla cultura ed alle credenze della cultura messicana e senza alcun dubbio lo stile del gioco è uno dei suoi punti forti e di distinzione. Il combattimento poi, credo che sia molto ben strutturato. Di base si hanno attacchi normali, salti e rotolate a cui presto saranno affiancati altre possibilità, come schiacciate, uppercut, dash e testate. Inoltre il gioco permette di afferrare e lanciare certi nemici dopo che avranno subito una certa soglia di danno, che se lanciati in direzione di altri nemici potranno danneggiare anche quest'ultimi. Combinare le varie mosse, quindi, da molta soddisfazione durante i combattimenti. Degne di segnalazione anche tutte le boss-fight, che sono sufficientemente varie e ognuna con le proprie meccaniche peculiari. Per quel che riguarda invece le possibilità di movimento ed esplorazione, qui si segue il mantra dei metroidvania. Imparerete infatti il doppio salto, la possibilità di rimpicciolirvi, la possibilità di scalare i muri, di proiettarvi da un muro verso l'altro estremo della stanza e di cambiare mondo di gioco passando alla dimensione dei morti. Tutto quello che ci si aspetta da un metroidvania... forse anche troppo, nel senso che è esattamente quello che ci si aspetta da un metroidvania e saranno soluzioni che in altri titoli simili avrete sperimentato innumerevoli volte. A dire il vero, il fatto che i nuovi poteri sblocchino altre aree è vero fino ad un certo punto, nel senso che è estremamente improbabile che decidiate ad un certo punto di tornare indietro in aree passate per sbloccare quella via che prima era inaccessibile... anche perchè sarà il gioco stesso a portarvi e guidarvi dove dovrete andare. Ebbene si, il gioco in realtà è abbastanza lineare ed a meno che non siate completisti o vogliate arrivare super preparati al finale, vi basterà seguire il percorso standard che il gioco propone. Devo dire inoltre che non ho apprezzato per niente il platforming e tutte quelle meccaniche che ci permettono di superare gli ostacoli forniti dai livelli. Innanzi tutto il salto è estremamente impreciso e capiterà spesso che si possa fare errori di calcolo per i salti, inoltre l'idea che alcune posizioni per essere raggiunte dovranno essere abbinate all'upercut è per me decisamente pessima. Non solo, ci sono sezioni di gioco dove vi sarà richiesto di eseguire diverse azioni in sequenza, tra salti, doppi salti, dash, uppercut, cambio di mondo e rotolata, roba che vi manderà facilmente al manicomio. E questo è evidente già circa a metà gioco, dove inspiegabilmente si ha una impennata improvvisa della difficoltà richiesta per poter muoversi all'interno del gioco. E' quindi palese che il gioco soffra di mal bilanciamento dalla metà in poi, fino al finale dove quei sadici degli sviluppatori han pensato bene di realizzare sezioni di gioco inutilmente contorte o che richiedono di imparare a memoria la sequenza di tasti da utilizzare se si vuole avere successo. Ebbene si, un gioco che inizialmente si era dimostrato piacevolissimo da giocare si è trasformato nel classico gioco try and error, dove la difficoltà diventa palesemente artificiale.  La struttura dell'intero gioco è alquanto discutibile e per certi versi ridondante. A sequenze esplorative si alternano sempre degli stanzoni che vengono chiusi dove spawneranno i nemici e quindi tutto questo si continuerà a ripetere fino al finale.  E' stato inoltre strano il fatto che nelle fasi finali gli sviluppatori hanno pensato bene di imbottire le stanze di nemici e di realizzare dei nemici alquanto fastidiosi da combattere, tra cui alcuni dove dovrete, oltre a cambiare mondo per poterli colpire, anche colpirli appositamente con un potere apposito per poter rompere il loro scudo che li protegge dagli attacchi, nel mentre che gli altri nemici, presenti nell'altro mondo quindi non colpibili, continueranno a rompervi le scatole. Guacamelee è quindi un gioco dalle due facce, divertentissimo in certi momenti, frustante in altri. Il risultato è un metroidvania nella media, che possiamo nel complesso considerare un buon gioco, nonostante tutto, ma che è ben lontano dai mostri sacri del genere come Hollow knight, che nonostante sia un gioco probabilmente anche più difficile di questo, è immensamente più piacevole da giocare.  VOTO: 7"
199829788,76561198038590610,0,53,13.8,10.9,True,0,0,0.5,0,True,False,False,spanish,2025-07-15 03:29:47,2025-07-15 03:29:47,:)
199788891,76561198119951746,684,73,8.2,8.2,True,0,0,0.5,0,False,True,False,koreana,2025-07-14 15:02:54,2025-07-14 15:02:54,"과카몰리!   타격감 좋음  콤포 재밌음 엔딩 버그 그럴 수 있음 다음 작으로 갈 동기 충분  님들도 하셈  재밌음"
